rank,uri,artist_names,track_name,source,peak_rank,previous_rank,weeks_on_chart,streams
193,"spotify:track:5TtTijiNYtFc6ktQARjY30","KayBlack, Wall Hein","Preferida","WM Brazil",13,137,68,"1166718"
194,"spotify:track:5d5R5A3dkYJGnnOKt68bF5","MC Hariel, Mc IG, MC Marks, MC GP, Mc Kanhoto, Mc Luki","Vida Louca, Bela e Curta - Ao Vivo","WM Brazil",194,-1,1,"1163133"
195,"spotify:track:0ODlZu2uJ13I29NfFJJVir","Luan Santana, MC Kevin o Chris","PEGA ESCANDALOSO","Sony Music Entertainment",21,195,19,"1160395"
196,"spotify:track:6622KNu2dncVoEzJt1SGse","Mc Magal, Aaron Modesto, DJ Tafarel","Ilhabela 2","GR6 Music",180,180,2,"1157648"
197,"spotify:track:28atBekPVlTdnU4M9Z7udd","Dilsinho, Luísa Sonza, Malibu","Não Vai Embora","Malibu Studios",27,198,56,"1151088"
198,"spotify:track:1IHYVMeFy76X0Xl2DkLkDh","Ryu, The Runner, Veigh, 6ee","MVP","Som Livre",125,125,2,"1148736"
199,"spotify:track:6m8AgjfI28ER6odzMxmHtR","Racionais MC's","Vida Loka, Pt. 1","Boogie Naipe",176,189,8,"1142569"
200,"spotify:track:1pjpPXl66t4FeQaFscpG73","Henrique & Juliano","Cidade Vizinha - Ao Vivo","Virgin Music Label And Artist Services (S&D)",6,-1,73,"1141224"
