rank,uri,artist_names,track_name,source,peak_rank,previous_rank,weeks_on_chart,streams
193,"spotify:track:5y7yYXNSsT89A27DQxbmUL","Wesley Safadão, Ana Castela","Covardia","Wesley Safadao",17,130,28,"986613"
194,"spotify:track:7qoIhutxU269Zqo9PG5IOj","Pineapple StormTv, Chris MC, Salve Malak, Tz da Coronel, MC Cabelinho, Chefin, L7NNON, Luísa Sonza, Oruam, Xamã, N.I.N.A","Poesia Acústica 13","Pineapple StormTV",1,-1,59,"985325"
195,"spotify:track:1M6rclDhYmqRBMFGNJOFKB","NATTAN, Grandão Vaqueiro","Americana Na Vaquejada","Feeling",37,138,32,"983473"
196,"spotify:track:6m8AgjfI28ER6odzMxmHtR","Racionais MC's","Vida Loka, Pt. 1","Boogie Naipe",196,-1,3,"982786"
197,"spotify:track:56y1jOTK0XSvJzVv9vHQBK","Doja Cat","Paint The Town Red","Kemosabe Records/RCA Records",77,186,10,"980203"
198,"spotify:track:65CB461aKF5FvIuuzqUgXu","Mc Poze do Rodo, Vulgo FK, Portugal No Beat, Galdino","Ai Calica","Mainstreet Records",151,-1,4,"975754"
199,"spotify:track:06WkQibI8OhOLjDxIRKu5B","Sorriso Maroto, LUDMILLA, Belo","Ainda Gosto de Você / Já Era - Ao Vivo","Sony Music Entertainment",197,197,2,"973142"
200,"spotify:track:1ACALdBWViTpLBC14Ecv8E","MC Ryan SP, Mc Daniel, Kotim","Namora Aí","WM Brazil",18,-1,38,"968921"
