rank,uri,artist_names,track_name,source,peak_rank,previous_rank,weeks_on_chart,streams
1,"spotify:track:2InS5VWKJQbsFBKOsf1cJB","Dj GBR, Mc IG, MC Ryan SP, MC PH, Mc Davi, Mc Luki, Mc Don Juan, Mc Kadu, TrapLaudo, MC GP, MC GH do 7","Let's Go 4","GR6 Music",1,1,9,"9266458"
2,"spotify:track:00ZKeP47bZtswtANkvxz2j","Tropa do Bruxo, DJ Ws da Igrejinha, SMU, Triz, Mc Menor Thalis","Baile do Bruxo","Tropa Do Bruxo",2,2,4,"8445316"
3,"spotify:track:35D06z7kmwMmYYbyJ0BkSm","Manu, Simone Mendes","Daqui pra Sempre","manuoficial",3,5,6,"7358423"
4,"spotify:track:6AENBD8I0mDGglFqrRZGu7","Gusttavo Lima, Ana Castela","Canudinho - Ao Vivo","Sony Music Entertainment",2,3,10,"6583928"
5,"spotify:track:42JNab8NPeCADJ9D3Cl5wS","Zé Neto & Cristiano","Barulho Do Foguete - Ao Vivo","Som Livre",4,4,19,"5861144"
6,"spotify:track:4Z2i41GDQyu3KRpBavEnyR","Ana Castela","Solteiro Forçado - Boiadeira Internacional","AgroPlay do Brasil",3,7,18,"5277746"
7,"spotify:track:4f0aDk7HX37SfzerfznYlr","Grupo Menos É Mais, Matheus Fernandes","Lapada Dela - Ao Vivo","Som Livre",4,8,37,"5117748"
8,"spotify:track:4YKujFSyakVjLdH1sDllVc","Simone Mendes","Dois Fugitivos - Ao Vivo","Universal Music Ltda.",8,13,8,"5032888"
9,"spotify:track:3XIXklO3e0uWUAUkOR7NLI","Luan Pereira, Mc Daniel, MC Ryan SP","DENTRO DA HILUX","Som Livre",2,6,11,"5013150"
10,"spotify:track:64CovjRwInpOJW4PiGMprY","MC Kevin o Chris, Dj Nk Da Serra, Mc Magrinho","Faz um Vuk Vuk (Teto Espelhado)","MC Kevin o Chris",1,9,16,"4775081"
11,"spotify:track:54u86CmMqGI1rRuULlTqaB","Felipe Amorim","Toca o Trompete","One Play",2,12,16,"4335975"
12,"spotify:track:2cZ62VBKsdZ7u1kKKJdFOc","Marshmello, Luísa Sonza","Sou Musa do Verão","Sony Music Latin",12,-1,1,"4292153"
13,"spotify:track:4zNy0cxc4p36OLdPr0sI6h","DJ Arana, MC Maneirinho, Mc Luan, MC Tigrão, Mc Barbie","MONTAGEM ANOS 2000","TRX",10,11,8,"4281274"
14,"spotify:track:07DskqQ1NbTiotX1WIV7ob","Flora Matos","Piloto","Flora Matos",7,10,8,"4156411"
15,"spotify:track:7GScY8oE12cqTiNBzVQpUB","Gusttavo Lima, Matheus & Kauan","Mala dos Porta-Mala - Ao Vivo","Sony Music Entertainment",8,15,17,"4079969"
16,"spotify:track:7GjAXYuxjuXPbQJzRnNdob","GREGO, Paulo Pires, ÉaBest","Pane no Sistema","ÉaBest",16,28,4,"4024044"
17,"spotify:track:3PqU6gHWUaBTtIZi5oxEJ7","Zé Neto & Cristiano","Um Mês E Pouco - Ao Vivo","Som Livre",11,16,20,"3925010"
18,"spotify:track:4uqJelb9THHmJ3OCohg4ZJ","AgroPlay, Ana Castela","Nosso Quadro","AgroPlay",1,14,40,"3887717"
19,"spotify:track:7DkhndGTKaqkFxxKN7XlAh","Guilherme & Benuto, Simone Mendes","Manda um Oi - Ao Vivo","Sony Music Entertainment",17,17,26,"3866110"
20,"spotify:track:0redQHBfejmPUhonR5ppGC","Guilherme & Benuto, Ana Castela, Adriano Rhod","Duas Três","Sony Music Entertainment",8,18,39,"3697033"
21,"spotify:track:7G2yGMHlcPPTCDhMrAaMyZ","Ana Castela","Tô Voltando - (Boiadeira Internacional)","AgroPlay",21,24,11,"3665266"
22,"spotify:track:3PH1nUysW7ybo3Yu8sqlPN","Israel & Rodolffo, Mari Fernandez","Seu Brilho Sumiu - Ao Vivo","Som Livre",2,21,36,"3620985"
23,"spotify:track:6drlqBh6BeYZinmYQ9qR2n","Rogerinho","Furduncinho do Rogerinho","Rogerinho",19,19,11,"3591328"
24,"spotify:track:4zW6JV4aqhXpbfZLZyEFvP","Henrique & Juliano","Quase Algo - Ao Vivo Em Nova Iorque / 2022","Virgin Music Label And Artist Services (S&D)",24,27,8,"3555743"
25,"spotify:track:0fABszUFNbNq9IW503Gj8v","DENNIS, MC Kevin o Chris","Tá OK","Sony Music Entertainment",1,22,25,"3551818"
26,"spotify:track:53PpijFATt35Zxfl6LTxoK","Marília Mendonça","Leão","Som Livre",1,26,48,"3500160"
27,"spotify:track:4hKLzFvNwHF6dPosGT30ed","Veigh, Bvga Beatz, Prod Malax, Supernova Ent","Novo Balanço","Supernova Entertainment Under Exclusive License to UnitedMasters",2,20,25,"3455027"
28,"spotify:track:7lTVXJfNK4xaJSUXCUac6a","Felipe Amorim, Mc Mika","Fode Bem","One Play",7,30,15,"3378747"
29,"spotify:track:6vq7r1Pqd3pyI07u63cPZV","Simone Mendes","Erro Gostoso - Ao Vivo","Universal Music Ltda.",3,31,41,"3345504"
30,"spotify:track:0QcKkN8b4iVkmVsbaze8OS","Henrique & Juliano","Devia Ser Proibido - Ao Vivo Em Brasília","Virgin Music Label And Artist Services (S&D)",30,33,15,"3224771"
31,"spotify:track:1Vy9Wn5sbiduZKBqBlH3Mc","Vulgo FK, MC PH, Veigh, Pedro Lotto, Fepache","Ballena","Som Livre",3,23,17,"3209176"
32,"spotify:track:5WV6br0BPUzhJwyBty80s0","Juliette","Tengo","Virgin Music Label And Artist Services (S&D)",4,25,14,"3196615"
33,"spotify:track:4zUFA8l78k4tCmoVuGtV8z","Luan Santana","MEIO TERMO - Ao Vivo","Sony Music Entertainment",10,32,22,"3178617"
34,"spotify:track:2uhw2oYbugGJbn10wipNX5","Mc Livinho, DJ Matt D","Novidade na Área","MBB Diamond",1,29,20,"3131035"
35,"spotify:track:7r8yMaSOy4XmuhRz7iv1gi","Henrique & Juliano","Traumatizei - Ao Vivo Em Brasília","Virgin Music Label And Artist Services (S&D)",6,34,40,"2979612"
36,"spotify:track:4lL0M9HzNFspnIwj2WfU6c","Gusttavo Lima, Wesley Safadão","Oi Vida - Ao Vivo","Sony Music Entertainment",28,38,15,"2935611"
37,"spotify:track:62W2f0QOg20ufNjJQHqnkq","Mc IG, MC Ryan SP, MC PH, DJ Glenner, DJ Oreia, Gabb MC, MC Bruno MS, MC GP, MC Rhamon, Mc Dena, TrapLaudo","Fernando de Noronha","WM Brazil",30,35,10,"2887994"
38,"spotify:track:1Z3QqD45wKKN6fUKBXSvcZ","Diego & Victor Hugo, Luan Pereira","Pirulito Vermelho","Sony Music Entertainment",27,37,21,"2810494"
39,"spotify:track:7Iq55toOSSBCEoGuXxQSa1","Mc Danone, DJ THG, Dj Hm Oliveira","Vem Quebrando","A2M Produtora",39,39,11,"2793128"
40,"spotify:track:4wjDiZGsZYQqKkXyPcQGF6","MC K.K, Love Funk, LeoZera","Agudo Mágico 4","Love Funk",36,36,7,"2785486"
41,"spotify:track:4KGyltc1ugN2WFcjkSPHwh","Matheus & Kauan, Mari Fernandez","Não Vitalício (Nunca Mais) - Ao Vivo","Universal Music Ltda.",7,42,40,"2732967"
42,"spotify:track:0KhLYwYVhi13hMhxX73m55","Luan Santana","MULHER SEGURA - Ao Vivo","Sony Music Entertainment",24,44,8,"2678809"
43,"spotify:track:2BlFIe0712LBUtTHxbqjme","NATTAN, Felipe Amorim","Love Gostosinho - Ao Vivo","Vybbe",12,41,43,"2626087"
44,"spotify:track:4pWsXhLUdtBKlw9npIXZAl","Kadu Martins","Halls na Língua","Kadu Martins",9,40,25,"2623682"
45,"spotify:track:6rpUGV7bcWW9ro65Bf8uYY","Israel & Rodolffo, Mc Don Juan, João Gomes","Eu Não Dou Conta - Ao Vivo","Som Livre",45,48,7,"2479372"
46,"spotify:track:4dHMuSjpkUcWW3zZehOFj7","Maiara & Maraisa","Narcisista - Ao Vivo","Som Livre",27,47,17,"2397327"
47,"spotify:track:0Q1oLvAI9QaD3DIlvluTqx","Israel & Rodolffo","Voltou Com Quem Não Voltava - Ao Vivo","Som Livre",42,51,25,"2354693"
48,"spotify:track:1mimc5QiUuwmVYdXkWvgOQ","Luan Pereira, Gustavo Mioto","MOLETOM","Som Livre",9,45,19,"2265920"
49,"spotify:track:2pidGuLSSVZPcbzE5QA1Ux","Hugo & Guilherme","Elevador - Ao Vivo","Som Livre",35,46,22,"2262180"
50,"spotify:track:6e5byyKtx6R0h66gagelPe","Gustavo Mioto, Mc Don Juan","Quando Apaga A Luz - Ao Vivo","Universal Music Ltda.",13,54,42,"2175588"
51,"spotify:track:2HRgqmZQC0MC7GeNuDIXHN","Jung Kook, Latto","Seven (feat. Latto) (Explicit Ver.)","BIGHIT MUSIC",19,111,17,"2147044"
52,"spotify:track:4uLzGOlqSanpNS3htaUViY","Zé Neto & Cristiano","Pátio do Posto - Ao Vivo","Som Livre",19,49,33,"2121039"
53,"spotify:track:3P2ubMyuL9NQOVU67TVCXA","Melody, Naldo Benny, Matheus Alves","Love, Love","Melody",19,43,21,"2113424"
54,"spotify:track:3rUGC1vUpkDG9CZFHMur1t","Tate McRae","greedy","RCA Records Label",48,50,6,"2108470"
55,"spotify:track:4xAGuRRKOgoaZbMGdmTD3N","Zé Neto & Cristiano","Oi Balde - Ao Vivo","Som Livre",3,52,38,"2087848"
56,"spotify:track:6tGlPVCrjerAAbKJs85m5g","Henrique & Juliano","Seu Erro - Ao Vivo Em Nova Iorque / 2022","Virgin Music Label And Artist Services (S&D)",56,58,3,"2072640"
57,"spotify:track:2KslE17cAJNHTsI2MI0jb2","Jung Kook","Standing Next to You","BIGHIT MUSIC",57,-1,1,"2025683"
58,"spotify:track:4ldcxPVAtih8alepJTu8Hx","Mc IG, DJ WN","Faz Completo, Chefe","WM Brazil",25,61,13,"1998055"
59,"spotify:track:6hu4HvpNzrW2RIEEAZC3vD","KayBlack, Marquinho no Beat, Wall Hein","Segredo","WM Brazil",19,60,32,"1992146"
60,"spotify:track:6xRDvureEBwHgwAYDufbJL","Eric Land, Tarcísio do Acordeon","Chorei na Vaquejada","Eric Land",15,59,25,"1983153"
61,"spotify:track:307kaV2BoOC4pRRzwJUJxf","Anitta","Mil Veces","Republic Records",30,53,3,"1924018"
62,"spotify:track:758BVp2SU3uGru062K5cju","Ana Castela","Alerta de Golpe - Ao Vivo","AgroPlay",55,55,4,"1864685"
63,"spotify:track:181TYnNi3wNGrdsCykmI4A","Luísa Sonza","A Dona Aranha","Sony Music Entertainment",15,66,11,"1858477"
64,"spotify:track:3S8M3mZGIc10IdtmNTsrjQ","Traia Véia, Murilo Huff","Eu Não Previ - Ao Vivo em Goiânia","Show Mix.",64,103,14,"1810142"
65,"spotify:track:3hfCle1QRfbwIpQ1B746lV","MC Saci, Complexo dos Hits, DJ Sammer, Mc Pretchako","Aquariano Nato","eumcsaci",65,72,6,"1806884"
66,"spotify:track:0GTUqRzwAacEI5Pll8YlBA","Israel & Rodolffo, Hugo & Guilherme","Amor Não Dá Em Copo - Ao Vivo","Som Livre",66,86,2,"1803729"
67,"spotify:track:39xOREhViooEYFpmnKTdrl","Veigh, Tz da Coronel, Toledo, Nagalli, Bvga Beatz, Supernova Ent","Engana Dizendo Que Ama","Supernova Entertainment Under Exclusive License to UnitedMasters",11,64,25,"1797708"
68,"spotify:track:4ASA1PZyWGbuc4d9N8OAcF","Gustavo Mioto, Mari Fernandez","Eu Gosto Assim - Ao Vivo","Universal Music Ltda.",1,63,60,"1761346"
69,"spotify:track:1KEhkxdCRb1k8UDHqACgNY","Lauana Prado, Guilherme & Benuto","Desandei - Ao Vivo","Universal Music Ltda.",41,71,28,"1738103"
70,"spotify:track:77BR4gaUAp3p0uA8UL6HT9","Belle Kaffer, Ana Castela, Charles New","Não Para","WM Brazil",33,67,36,"1737457"
71,"spotify:track:156LKAN2oh16qflL5oz4tO","MC PH","Os Bico Tão Se Perguntando (Let’s Go 3)","GR6 Music",11,73,31,"1729914"
72,"spotify:track:2pRjaIcGc9LOmu7x9XMswA","Diego & Victor Hugo, Henrique & Juliano","Calafrio (feat. Henrique & Juliano) - Ao Vivo | Bônus Track","Sony Music Entertainment",72,76,3,"1701380"
73,"spotify:track:6L2ule7uWSdh1qjcMO3vUD","Murilo Huff, Wesley Safadão","Quem tá Pegando","M Show",42,56,25,"1686800"
74,"spotify:track:2J4nJffXU569d2ld9yxH6D","Juliette","Ciclone","Virgin Music Label And Artist Services (S&D)",74,136,6,"1679202"
75,"spotify:track:0U9CZWq6umZsN432nh3WWT","Mc Pedrinho, DJ 900","Gol Bolinha, Gol Quadrado 2","GR6 Music",3,68,22,"1667780"
76,"spotify:track:0SWDToufOxRVIngk8c1oZi","Luan Santana","AMBIENTE ERRADO - Ao Vivo","Sony Music Entertainment",29,65,14,"1641471"
77,"spotify:track:735MbOmMNSTMmPVrY51LBh","Ana Castela","Aqui Tem Alguém - Ao Vivo","AgroPlay",77,110,2,"1632630"
78,"spotify:track:1V4l4h7kYaKyXJk74g6ilu","Israel & Rodolffo","Guardanapo Borrado - Ao Vivo","Som Livre",69,69,16,"1612340"
79,"spotify:track:2yIJ2CVZkTDftAsL9NPTw2","Guilherme & Benuto, Wesley Safadão","Milionário - Ao Vivo","Sony Music Entertainment",56,85,9,"1611236"
80,"spotify:track:6LSza8vBsCd7xLk13cYhIv","MC PH","Jovens Milionários (Let's Go 2)","GR6 Music",78,78,10,"1583975"
81,"spotify:track:7IPEkUJsnWYNyBkK2i2FPj","Hugo & Guilherme","Mágica - Ao Vivo","Som Livre",11,75,32,"1579597"
82,"spotify:track:2LTlykcdu0gwb7zcKneo2a","KayBlack, Baco Exu do Blues, Marquinho no Beat","Melhor Só","WM Brazil",3,83,32,"1544632"
83,"spotify:track:1dNaW9Zy3lSgwylHwR75Ro","DJ Maninho, Dj Dudu, MC Teteu, Mc Gw","Mega Funk Lost","S&R Editora",83,124,2,"1534926"
84,"spotify:track:5eID9KNVJV2fDSPQGzQHQg","Gusttavo Lima, Maiara & Maraisa","Oficializar - Ao Vivo","Sony Music Entertainment",49,84,11,"1526725"
85,"spotify:track:3l5VjEAeUTqrlD50iEo8Yn","KayBlack, AMUSIK, Wall Hein","Licor 43","Elenko Music",64,82,60,"1526359"
86,"spotify:track:01qFKNWq73UfEslI0GvumE","Jung Kook, Jack Harlow","3D (feat. Jack Harlow)","BIGHIT MUSIC",58,191,6,"1515371"
87,"spotify:track:4AKsSRxe6z6woOAsXr5gVA","Mc Kevin, MC Hariel, DJ Jorgin","Coração na Geladeira 2","WMD",73,87,17,"1509048"
88,"spotify:track:5aIVCx5tnk0ntmdiinnYvw","Tyla","Water","FAX Records/Epic",74,74,4,"1507256"
89,"spotify:track:2uGk60j3LR5bp6tGq9vtII","GORDÃO DO PC, Kadu Martins, DJ LUCAS DE PAULA, MC Kevin o Chris","Halls na Língua - Remix","GORDÃO DO PC",28,57,17,"1485903"
90,"spotify:track:1gUKbDEyGK4uo8t8MdjKMZ","Clayton & Romário, Luan Santana","Namorando Ou Não - Ao Vivo","Virgin Music Label And Artist Services (S&D)",14,80,35,"1485210"
91,"spotify:track:4nHN8qxD9UJCSqqvFmRBzq","Dj Bruninho Pzs, Dj Mano Lost, MC MENOR KAUAN","Calma Amor, Calma Bb","DJ BRUNINHO PZS Digital",71,77,4,"1481365"
92,"spotify:track:2M4kQD87lKnAS9vFlb4Bez","Matheus & Kauan, Jorge & Mateus","Pactos - Ao Vivo","Universal Music Ltda.",6,89,56,"1445916"
93,"spotify:track:6zLBR9izBeZ1d0pfuwJgRa","Mc Ws da leste, MC Cothiê, Dj Chadin do C","Tipo Hollywood","Fera Entretenimento",93,-1,1,"1433031"
94,"spotify:track:3ktTWpYdXrYApH54cBo4Ap","Matuê, Rich The Kid","Conexões de Máfia (feat. Rich The Kid)","Sony Music Entertainment",1,88,28,"1424882"
95,"spotify:track:7bz3kEKKtEONtzxB6jrnb5","Mc Don Juan, Mc Kako, DJ BOY, Gabb MC, MC Joãozinho VT, MC Marks, MC Vine7, Mc Robs","Banco do Carona","WM Brazil",78,114,22,"1423334"
96,"spotify:track:4Dvkj6JhhA12EX05fT7y2e","Harry Styles","As It Was","Columbia",10,100,84,"1418201"
97,"spotify:track:4N4Jk8n24I4lkSUdzoS0n7","Zé Neto & Cristiano","Alô Tranqueira - Ao Vivo","Som Livre",62,81,5,"1409549"
98,"spotify:track:64I2WXRrFWWxjRh8uTYYQB","Henrique & Juliano","Abre A Mente - Ao Vivo Em Brasília","Virgin Music Label And Artist Services (S&D)",64,95,22,"1409234"
99,"spotify:track:1M9JZXjz6GCUH7VbFFBmJx","Ferrugem","Todo Amor do Mundo","WM Brazil",88,127,10,"1398385"
100,"spotify:track:1kWcd9h9HoeXsKaDVhSOtj","Sorriso Maroto, Ferrugem","Ela - Ao Vivo","Sony Music Entertainment",81,99,8,"1379164"
101,"spotify:track:2Vl7x4BkNhhJkEmQQMcV0V","Mc Jacaré","Toma Tapa","A Chave",27,92,48,"1364582"
102,"spotify:track:3PLdcrfVesYKyTpS1EXsxO","Dilsinho","Diferentão - Ao Vivo","Sony Music Entertainment",91,91,18,"1363264"
103,"spotify:track:6eNRGL6Nkdg7RhJtmbcl0j","Mc Tato, DJ Ak beats","Luz do Luar","RF PRODUTORA",7,120,46,"1360846"
104,"spotify:track:5aqwwgL4XOv2YJYwLiqKOZ","Maiara & Maraisa","A Culpa É Nossa - Ao Vivo","Som Livre",8,93,47,"1359741"
105,"spotify:track:6ELMBm3lZFitAZp03GBBNG","Gabriela Rocha","Me Atraiu - Ao Vivo","Onimusic",75,106,38,"1356766"
106,"spotify:track:3o4wcB1Y6xC62eF02n9RSZ","Luan Pereira, MC Ryan SP","ELA PIROU NA DODGE RAM","Som Livre",14,101,34,"1341395"
107,"spotify:track:0oZrvoCYEbKGCsU7cQqNnw","Yago Oproprio, Rô Rosa, Skeeter Beats","Imprevisto","Som Livre",32,97,55,"1335842"
108,"spotify:track:2exu569k07hUulN9CoPnMH","Luísa Sonza","Campo De Morango","Sony Music Entertainment",14,148,13,"1312212"
109,"spotify:track:27ECP9NCzTAoTpxXNePZuS","Mc Paiva ZS, Love Funk, DJ Ak beats","01 Não É 02","Love Funk",74,105,20,"1304938"
110,"spotify:track:5asabafNzfAzjUecDvuNES","Henrique & Juliano","Aquela Pessoa - Ao Vivo","Virgin Music Label And Artist Services (S&D)",39,139,93,"1288970"
111,"spotify:track:1BxfuPKGuaTgP7aM0Bbdwr","Taylor Swift","Cruel Summer","Taylor Swift",95,118,24,"1278948"
112,"spotify:track:5ME83xsz5O9u3A0qhMtKyj","Mc IG, Murillo e LT no Beat","Jogo do Corinthians","WM Brazil",112,178,9,"1278509"
113,"spotify:track:2D1rmVTeaZrr5Ipow29t4b","LUDMILLA","Sintomas de Prazer","WM Brazil",99,153,11,"1276533"
114,"spotify:track:12YCtLHGk6tP6RbHDHflCs","MC Caverinha, KayBlack, Wall Hein","Cartão Black","Som Livre",1,113,26,"1271755"
115,"spotify:track:22sAwsBH0NoNJXnrBenQuO","MC Xenon, Os Gemeos da Putaria","Sem Aliança no Dedo","DC MUSIC",3,126,40,"1269694"
116,"spotify:track:6a35UETcJteB4oVCSFoAqr","MC Ryan SP, Orochi, MC Hariel, DJ BOY, Oruam","Perfeita","WM Brazil",81,158,8,"1256397"
117,"spotify:track:74Le949TrZk4zwDjtWzH23","Bruno & Denner, Gusttavo Lima","Cavalo de Pau","Balada Music",46,109,56,"1254597"
118,"spotify:track:4aFZiSRqkxC5sIbSDMWBE5","Wesley Safadão","Rua - Ao Vivo em Bahamas","Wesley Safadao",94,94,8,"1253701"
119,"spotify:track:3khLpwuyIjEOw8vfJ1oUIT","MC Kevin o Chris, MC Caja","Papin","MC Kevin o Chris",17,117,30,"1248406"
120,"spotify:track:5HlcsBdjb5TiZeZ3ngWRv0","Raí Saia Rodada, João Gomes","5 Da Manhã - Ao Vivo","Som Livre",92,107,7,"1240445"
121,"spotify:track:54FV2rMVwLusAVnzROB0c1","Orochi, Caio Luccas, Pedro Lotto, Mainstreet, Galdino, Ribb","Mesma História","Mainstreet Records",121,159,4,"1239691"
122,"spotify:track:5btDKzAsFh975NSWxwBHRc","Felipe Amorim","Coisas Que Eu Sei","One Play",44,104,30,"1239369"
123,"spotify:track:3gCWngngUs1uojw33vrE8K","Jorge & Mateus","5 Regras - Ao Vivo","Som Livre",7,115,67,"1235474"
124,"spotify:track:7zmS0vPbWg2k6sfL3uqrGD","Luiza Martins, Matheus & Kauan","Cê Não Me Superou - Ao Vivo","Som Livre",69,112,21,"1233709"
125,"spotify:track:5Ubx4DpvVodvsGH9ilxPVi","Guilherme & Benuto, Hugo & Guilherme","Haja Colírio (feat. Hugo & Guilherme) - Ao Vivo","Sony Music Entertainment",2,108,72,"1230343"
126,"spotify:track:1a5LfJGq0vuCWQ9Mme0Ac7","Maria Marçal","Deserto (Ao Vivo)","MK Network",85,132,57,"1225589"
127,"spotify:track:0zxWyvrKyz031tFfBnkYLr","Henrique & Juliano","Como É Que A Gente Fica - Ao Vivo","Virgin Music Label And Artist Services (S&D)",23,135,51,"1221058"
128,"spotify:track:6kNZdlmjH4BQnSUfHeJIuc","Dj GBR, Mc IG, MC Ryan SP, MC Marks, Mc Don Juan, MC PH, Mc Luki, Mc Paiva ZS, MC GP, Makalo","Let's Go 3 (feat. MC Marks, Mc Don Juan, MC PH, Mc Luki, Mc Paiva ZS, MC GP & Makalo)","Sony Music Entertainment",81,137,54,"1217563"
129,"spotify:track:4vdFF0P7oTZoeKvnfIsbh3","Henrique & Juliano","Te Esqueci Sem Querer - Ao Vivo Em Brasília","Virgin Music Label And Artist Services (S&D)",43,134,29,"1217052"
130,"spotify:track:09pQ3lGyMTpW3rz7a71zwQ","Hugo & Guilherme","Metade De Mim - Ao Vivo","Som Livre",24,116,36,"1206710"
131,"spotify:track:5XeFesFbtLpXzIVDNQP22n","Arctic Monkeys","I Wanna Be Yours","Domino Recording Co",96,149,61,"1206080"
132,"spotify:track:2xs2TwrlfamtW0DQqId0M5","DJ BOY, Mc Don Juan, MC Joãozinho VT, Mc Kako, MC Hariel, MC Tuto, MC Marks, MC Vine7","Set Dj Boy 3.0","Sonar Music",87,143,26,"1205699"
133,"spotify:track:0tBgLNgCmRTmqrydcFfQjt","Pedro Paulo & Alex, Ana Castela","Ia Dar Bom","Artinvox",78,129,23,"1205529"
134,"spotify:track:5TtTijiNYtFc6ktQARjY30","KayBlack, Wall Hein","Preferida","WM Brazil",13,122,32,"1203741"
135,"spotify:track:1OZ4uv7OAP24Ix6j3vojLt","Mc Paiva ZS, MC Ryan SP, Kotim","Casei Com a Putaria","Love Funk",1,142,70,"1203301"
136,"spotify:track:5WGTBzRLbjj0Sm3Br8X1rI","Mc Paiva ZS, Gabb MC, Dj Aladin GDB, Love Funk","Bandido Não Dança","Love Funk",32,144,43,"1188854"
137,"spotify:track:0SCMVUZ21uYYB8cc0ScfbV","Israel & Rodolffo, Ana Castela","Bombonzinho - Ao Vivo","Som Livre",1,121,53,"1188096"
138,"spotify:track:7nFvKgVumc9FcU97zGjjei","WIU","Coração de Gelo","Sony Music Entertainment",4,147,49,"1187623"
139,"spotify:track:7McCAKExE8KsI2q4Y8wx4U","Murilo Huff, Marília Mendonça","Dois Enganados","M Show",49,161,69,"1185437"
140,"spotify:track:5r9CZJMoMmxio2AnJdxuDS","Grupo Menos É Mais, Di Propósito, Vou Zuar","Pot-Pourri: Melhor Eu Ir / Ligando Os Fatos / Sonho de Amor / Deixa Eu Te Querer - Ao Vivo","Som Livre",21,131,178,"1178816"
141,"spotify:track:5geU4byUA1hnQofQPOsPDS","Orochi, MC Ryan SP, Oruam, Xamã, Neo Beats, Kizzy, Mainstreet","Sereia","Mainstreet Records",8,156,54,"1171369"
142,"spotify:track:25ozhTrBf6vc13i1QcNNN4","Ferrugem","Interessante","WM Brazil",112,-1,18,"1161802"
143,"spotify:track:7sopDXkuzXtHt8AQpdBxmT","Ana Castela","DONA DE MIM","AgroPlay",13,165,46,"1151832"
144,"spotify:track:1IZmGrAEkq98MxDQCYhtjJ","KayBlack, Wall Hein, Caio Passos, Yokame","Disposição e Atividade","WM Brazil",72,145,5,"1150379"
145,"spotify:track:56JVZMurnXPoy1HbB4dcNV","Manu, Mari Fernandez","Abismo","manuoficial",145,-1,1,"1147500"
146,"spotify:track:006pMMCuRo2TFjh8sNGSov","Charlie Brown Jr.","Dias De Luta, Dias De Gloria","EMI Brazil",120,163,29,"1138778"
147,"spotify:track:6bTdZ7xfKp3NqqADJ8HLyj","Matuê, WIU, Teto","Vampiro","Sony Music Entertainment",1,162,84,"1138506"
148,"spotify:track:4D25RP3yiJWfW9utK9dMyv","Rayane & Rafaela, Henrique & Juliano","Ali Te Ama - Ao Vivo","Henrique e Juliano oficial",148,-1,2,"1138269"
149,"spotify:track:3O2wrDL7nnSDZOrdZqxyoY","Mc IG, MC Pipokinha, DJ Glenner","Noite Fria","GR6 Music",20,173,36,"1135955"
150,"spotify:track:2HMbGPbGiqGaHXzFkQAmZI","Matheus & Kauan","Basiquinho - Ao Vivo","Universal Music Ltda.",16,151,56,"1133370"
151,"spotify:track:1Od9NokLPxoWIZKIbImt6P","Mc IG, DJ Oreia","Ninguém Tá Puro","GR6 Music",129,133,8,"1133191"
152,"spotify:track:7MXVkk9YMctZqd1Srtv4MB","The Weeknd, Daft Punk","Starboy","Universal Republic Records",6,160,68,"1130110"
153,"spotify:track:3EM71GPnUGJ75uDhkH77pq","LUDMILLA, Marília Mendonça","Insônia - Ao Vivo","WM Brazil",46,157,40,"1126347"
154,"spotify:track:4kAMyuJBbmJrbr6TLOWbEk","Diego & Victor Hugo, Jorge & Mateus","Beijo de Glicose - Ao Vivo","Sony Music Entertainment",6,154,59,"1124873"
155,"spotify:track:0EMf4CzvPd1z50iqRbmLfl","Maria Marçal","Deixa","MK Music",136,166,9,"1124302"
156,"spotify:track:4bxAq0zgWQKMaQJ7HLJJxk","Marina Sena, Chicão do Piseiro, Roni Bruno, Mts No Beat","Ombrim (ai que delicia o verão) (feat. Mts No Beat)","Sony Music Entertainment",103,125,8,"1120987"
157,"spotify:track:5DcysyjaPrLzXgDauvzvn6","George Henrique & Rodrigo, Guilherme & Benuto","Beijo Equivocado","Worldshow Promoções e Eventos",95,182,7,"1116853"
158,"spotify:track:19TnKf5YHapfrI1FJjbx8i","cjnobeat, Bibi Babydoll, Mc Gw","É Tesão ou É Amor","VL Produções",158,-1,1,"1108543"
159,"spotify:track:0a3hjvUXenNxbCknm0zpOh","DJ BOY, MC Tuto, MC Marks, MC Joãozinho VT, MC Vine7, Gabb MC, MC Ryan SP","Olá Mercedes","Sonar Music",97,150,10,"1105274"
160,"spotify:track:0yZRkiCSy4ra9EykuYyGo0","Vulgo FK, Kyan, Bvga Beatz, Toledo","Mandona (Se eu te dissesse)","GR6 Music",47,172,27,"1104215"
161,"spotify:track:5wwbnoRORYlLYf9QZAzrm7","Mc Kako","Ísis","Sonar Music",161,176,2,"1095971"
162,"spotify:track:3nI0piSOxAik2RCpHGloB7","Charlie Brown Jr.","Só Os Loucos Sabem","Best",162,-1,5,"1095901"
163,"spotify:track:5qjwjBzWAxXjjqinjENzIF","Jorge & Mateus","Dói","Som Livre",55,155,14,"1084325"
164,"spotify:track:5pBU3Yihoa4hiwQ2T5fGhH","Guilherme & Benuto, Matheus & Kauan","Esse B.O é Meu - Ao Vivo","Sony Music Entertainment",15,152,52,"1083990"
165,"spotify:track:7EHlDvAa7gncwcAlfclZiX","Felipe Araújo, Luan Santana","Última Noite - Ao Vivo","Universal Music Ltda.",141,141,2,"1083975"
166,"spotify:track:4VvsTSxSSAu8IRBpt3iDMR","Isaias Saad","Bondade de Deus","Onimusic",152,171,28,"1080955"
167,"spotify:track:1rLahQ58edFplZKDcjJ7cH","Veigh, Luchinha Jr, Supernova Ent, Baby","Mandraka","Supernova Entertainment",91,164,40,"1072004"
168,"spotify:track:2orGm2E68ODFYOURjaES62","WIU, MC Ryan SP","Felina","Sony Music Entertainment",5,185,59,"1071630"
169,"spotify:track:1UVquahdeg6mRYDTHFKRx0","Delacruz","Sunshine","Delacruz Music",145,169,6,"1069259"
170,"spotify:track:2c80HnIOPMmQQVQllQEWb5","Matuê","É Sal","Sony Music Entertainment",10,168,44,"1064834"
171,"spotify:track:5vdQUAFncALEH9EQvyAqIX","DJ Jeeh FDC, MC LCKaiique, MC Celo BK, DJ Menezes, DJ Arana, Mc Yoshi","Forte Forte de Lacoste - Pra Começar o Final de Semana","24por48",39,146,22,"1064763"
172,"spotify:track:7AwVSKaQxpidrtYBerkHKk","Ana Castela, Melody, Dj Chris No Beat","Pipoco","Ana Castela",1,184,76,"1059977"
173,"spotify:track:2tFmuYL5D8zqBHvs0nG5Tn","KayBlack, Marquinho no Beat","Bonjour","GR6 Music",32,179,38,"1057102"
174,"spotify:track:1BCn0dTxjdd4IWDLBFIX6V","Avine Vinny, João Gomes","Cafézin de Vó - Ao Vivo","Sony Music Entertainment",174,196,2,"1048097"
175,"spotify:track:4qDT0BeJ7BjatrN9k8AvB4","Teto, WIU, Matuê","Flow Espacial","Sony Music Entertainment",6,190,41,"1045449"
176,"spotify:track:5g7sDjBhZ4I3gcFIpkrLuI","Bruno Mars","Locked out of Heaven","Atlantic Records",67,175,10,"1037958"
177,"spotify:track:77VEEXFqs8GlKhT1lWHcsE","Mc Poze do Rodo, MC Cabelinho, MC Ryan SP, Bielzin, Oruam, Portugal No Beat","A Cara do Crime 4 (Acendo a Flor)","Mainstreet Records",104,183,13,"1033876"
178,"spotify:track:0oB3IBEhbmgTrL7mV0VnFq","Kadu Martins","Novinha do Onlyfans - Tchan Ran Tchan Tchan","Kadu Martins",10,174,54,"1030630"
179,"spotify:track:1Iq8oo9XkmmvCQiGOfORiz","Taylor Swift","Is It Over Now? (Taylor's Version) (From The Vault)","Taylor Swift",79,79,2,"1025034"
180,"spotify:track:4qx6N7gtoRnqFHQKOS5AKH","Henrique & Juliano","Rancorosa - Ao Vivo Em Brasília","Virgin Music Label And Artist Services (S&D)",17,170,33,"1024034"
181,"spotify:track:0dcHD9QhnWRA41zoLnC83X","MC Cabelinho, Dallass","X1","MC Cabelinho",30,181,79,"1019463"
182,"spotify:track:0JbnM6rnFObzTrwKl7BPMb","Mc Kako","Tempo","Sonar Music",182,-1,1,"1017938"
183,"spotify:track:745VUhm32odbxJI2q1rUMv","MC Guh SR, MC Pê Original, Dj Pikeno Mpc, Markim WF","Ela Voltou de Perna Bamba","Fluxos Records",21,189,27,"1015832"
184,"spotify:track:0yHyFqe0f1MZXpAisMdSVb","Mc Morena, DJ DUCK","Automotivo Solitude","West Homi Recordz Brasil",170,195,4,"1014859"
185,"spotify:track:2QjOHCTQ1Jl3zawyYOpxh6","The Neighbourhood","Sweater Weather","Columbia",121,193,60,"1011206"
186,"spotify:track:1dv8qeBPtLAli7J3xNeTDR","Luísa Sonza, Baco Exu do Blues","Surreal","Sony Music Entertainment",31,200,11,"1008740"
187,"spotify:track:4uUG5RXrOk84mYEfFvj3cK","David Guetta, Bebe Rexha","I'm Good (Blue)","Parlophone UK",51,-1,49,"1004242"
188,"spotify:track:2gkVEnpahpE3bQuvGuCpAV","Jung Kook","Yes or No","BIGHIT MUSIC",188,-1,1,"1002338"
189,"spotify:track:4sfY9Q4rQKVwxQVKo6v04i","Vulgo FK, MC Ryan SP, Tkd, Bvga Beatz, MATHINVOKER","2023","Som Livre",77,180,17,"1002076"
190,"spotify:track:6JKkP9ABQzYZUFSKSVDKIc","1Kilo, Baviera, Knust, Pablo Martins","Deixe Me Ir (feat. Pablo Martins) - Acústico 1Kilo","TRPN",1,-1,147,"996426"
191,"spotify:track:5ONOlTiqymhzwcFjqcIT6E","Jung Kook","Hate You","BIGHIT MUSIC",191,-1,1,"987588"
192,"spotify:track:0EhGgIoOPjsqfB2ktrGgJd","Felipe e Rodrigo, Simone Mendes","Oceano - Ao Vivo","Virgin Music Label And Artist Services (S&D)",180,-1,2,"986839"
