rank,uri,artist_names,track_name,source,peak_rank,previous_rank,weeks_on_chart,streams
1,"spotify:track:6VBhH7CyP56BXjp8VsDFPZ","Pritam, Arijit Singh, Amitabh Bhattacharya","Kesariya (From ""Brahmastra"")","Sony Music Entertainment India Pvt. Ltd.",1,1,8,"7253468"
2,"spotify:track:7lvDsmTRXFE3dK4OjvRiWB","Shae Gill, Ali Sethi","Pasoori","Giraffe Pakistan",1,2,29,"4127063"
3,"spotify:track:1aL9518P5G72N92b48tuKw","AP Dhillon","Summer High","RUN-UP RECORDS",3,4,5,"4013924"
4,"spotify:track:08Isz2ETWSBhvIl8UpKYsp","Shubh","No Love","SHUBH",2,3,26,"3444520"
5,"spotify:track:6TQS7URegxmcb8tTNpoXzi","Dhanush, Anirudh Ravichander","Megham Karukatha (From ""Thiruchitrambalam"")","Sun Pictures",4,5,7,"3137884"
6,"spotify:track:29m79w9xPMH4YCD6r8JSmV","AP Dhillon, Gurinder Gill, Intense","Excuses","RUN-UP RECORDS",1,7,46,"2958788"
7,"spotify:track:1Nr46gjiP50uPsz30gYhAd","Santhosh Narayanan, Anirudh Ravichander","Thenmozhi (From ""Thiruchitrambalam"")","Sun Pictures",5,6,4,"2635642"
8,"spotify:track:0snQrp1VaY5Pj1YIHRJpRJ","Aditya A","Chaand Baaliyan","Sony Music Entertainment India Pvt. Ltd.",2,8,29,"2295973"
9,"spotify:track:0yCWDaAgOtg6TKlNCg9rwA","King","Tu Aake Dekhle","Warner Music India",6,11,84,"2178305"
10,"spotify:track:5W7DOVGQLTigu09afW7QMT","Sidhu Moose Wala","295","Sidhu Moose Wala",1,10,30,"2097092"
11,"spotify:track:0skYUMpS0AcbpjcGsAbRGj","BLACKPINK","Pink Venom","YG Entertainment/Interscope Records",7,9,3,"2064336"
13,"spotify:track:5IgjP7X4th6nMNDh4akUHb","Chris Brown","Under The Influence","Chris Brown Entertainment/RCA Records",13,28,4,"1946105"
14,"spotify:track:2eAvDnpXP5W0cVtiI0PUxV","Ruth B.","Dandelions","Columbia",14,16,41,"1877630"
15,"spotify:track:2rOnSn2piaqLAlYjtfUBlY","Tanishk Bagchi, Jubin Nautiyal, Asees Kaur","Raataan Lambiyan (From ""Shershaah"")","Sony Music Entertainment India Pvt. Ltd.",1,14,58,"1875009"
16,"spotify:track:6ZYxNjuAU9Vy3VtF6W1dtE","Shubh","We Rollin","SHUBH",10,13,41,"1874272"
17,"spotify:track:02MWAaffLxlfxAUY7c5dvx","Glass Animals","Heat Waves","Polydor Records",3,15,60,"1757943"
19,"spotify:track:6yvxu91deFKt3X1QoV6qMv","Anirudh Ravichander, Jonita Gandhi","Arabic Kuthu - Halamithi Habibo (From ""Beast"")","Sun Pictures",2,20,30,"1657188"
20,"spotify:track:6VhuP99TE6gYNQRJIlAWFD","Stephen Sanchez","Until I Found You","Republic Records",20,51,19,"1587510"
21,"spotify:track:72zHuDxFQTjbL51qJQSA7j","Jasleen Royal, B Praak, Romy","Ranjha (From ""Shershaah"")","Sony Music Entertainment India Pvt. Ltd.",1,19,57,"1570189"
22,"spotify:track:1pean7zvZUqcWZaUucH63f","Dhanush, Anirudh Ravichander","Thaai Kelavi (From ""Thiruchitrambalam"")","Sun Pictures",18,18,5,"1560251"
23,"spotify:track:5O2P9iiztwhomNh8xkR9lJ","One Direction","Night Changes","Syco Music",22,25,69,"1536194"
24,"spotify:track:0MHiYjjcHNYM9KURa6NveF","Dabzee, SA","Manavaalan Thug - From ""Thallumaala""","Muzik247",24,49,4,"1508177"
25,"spotify:track:0IGXY47K2ha3AHfX57wY1O","Pritam, Arijit Singh, Amitabh Bhattacharya, Jonita Gandhi","Deva Deva (From ""Brahmastra"")","Sony Music Entertainment India Pvt. Ltd.",23,32,5,"1501838"
26,"spotify:track:5PjdY0CKGZdEuoNab3yDmX","The Kid LAROI, Justin Bieber","STAY (with Justin Bieber)","Columbia",1,30,61,"1493197"
27,"spotify:track:58HvfVOeJY7lUuCqF0m3ly","Elley Duhé","MIDDLE OF THE NIGHT","Not Fit For Society/RCA Records",12,26,36,"1492804"
28,"spotify:track:7B4uYqxTpTOS1sgxFB9Ann","Sidhu Moose Wala, Wazir Patar","The Last Ride","Sidhu Moose Wala",3,24,17,"1479641"
29,"spotify:track:60YICjIPdL7LDBcCMK0tAk","Sidhu Moose Wala, Sunny Malton, The Kidd","Levels","Sidhu Moose Wala",8,29,15,"1470208"
30,"spotify:track:2FZDNh6tm9mkZ9vTphuAh8","Pritam, Tanishk Bagchi, Neeraj Shridhar","Bhool Bhulaiyaa 2 Title Track","T-Series",7,22,19,"1468685"
31,"spotify:track:4Dvkj6JhhA12EX05fT7y2e","Harry Styles","As It Was","Columbia",5,31,23,"1465453"
32,"spotify:track:2FCXQHugkoHE1K3tiDu8pu","Alka Yagnik, Arijit Singh","Agar Tum Saath Ho (From ""Tamasha"")","T-Series",4,33,171,"1456053"
33,"spotify:track:2J2Z1SkXYghSajLibnQHOa","Sia","Unstoppable","Monkey Puzzle Records/RCA Records",16,34,58,"1401498"
34,"spotify:track:3UhmuWcFaLS3AO3kI9ynQ2","AP Dhillon, Shinda Kahlon, Gurinder Gill, Gminxr","Insane","RUN-UP RECORDS",3,39,73,"1383086"
35,"spotify:track:0mBP9X2gPCuapvpZ7TGDk3","Charlie Puth, Jung Kook, BTS","Left and Right (Feat. Jung Kook of BTS)","Atlantic Records",4,27,11,"1362019"
36,"spotify:track:5WWplXimzIjlJiN2N7T9Q3","Anirudh Ravichander, Kamal Haasan","Pathala Pathala (From ""Vikram"")","Sony Music Entertainment India Pvt. Ltd.",6,37,17,"1358748"
37,"spotify:track:2tMoOS9grHtn4upzb4LwMG","Dhibu Ninan Thomas, Kapil Kapilan","Adiye - From ""Bachelor""","Think Music",16,35,40,"1349188"
38,"spotify:track:6A6mDExVoAEJmc5JyVSQeK","Anirudh Ravichander","Life of Pazham (From ""Thiruchitrambalam"")","Sun Pictures",19,21,4,"1348110"
39,"spotify:track:1rDjwexewf4hrdZT7SRNsH","Faridkot, Amar Jalal","Nasha (Equals Sessions)","Anahad Foundation",39,66,4,"1343248"
40,"spotify:track:78tblPcz2otRZd1VOeU7zz","Yuvan Shankar Raja, Sid Sriram","Kanja Poovu Kannala (From ""Viruman"")","Sony Music Entertainment India Pvt. Ltd.",17,23,13,"1318731"
41,"spotify:track:2qxmye6gAegTMjLKEBoR3d","Alec Benjamin","Let Me Down Slowly","2018",34,43,126,"1312300"
42,"spotify:track:0DXfJ2iKRDEG7rPgssWFea","Kanishk Seth, Kavita Seth","Rangisari (From ""Jugjugg Jeeyo"")","T-Series",22,40,13,"1306761"
43,"spotify:track:1y1rQTkWmrZdJmjwuK07GC","Vishal Mishra, Manoj Muntashir","Kaise Hua (From ""Kabir Singh"")","T-Series",5,44,169,"1300042"
44,"spotify:track:2vkNA9I029dTwX0y6d59Sc","Anirudh Ravichander, Anthony Daasan","Dippam Dappam (From ""Kaathuvaakula Rendu Kaadhal"")","Sony Music Entertainment India Pvt. Ltd.",13,41,20,"1299594"
45,"spotify:track:2eTkxblLeqdTSsb2ivafDX","Ankit Tiwari, Manoj Muntashir","Galliyan Returns (From ""Ek Villain Returns"")","T-Series",9,36,10,"1296789"
46,"spotify:track:0stbF4C1ACmIvx0aW81ZXa","Nakash Aziz, Sunidhi Chauhan","Ra Ra Rakkamma (From ""Vikrant Rona"")","Lahari Music",30,42,9,"1246777"
47,"spotify:track:3nlAERKIpn3ffgGwYQs0EB","Mitraz","Akhiyaan","Mitraz Records",23,45,19,"1235592"
48,"spotify:track:1smFN2CLqGROu0J0UyvDfL","Pritam, Arijit Singh","Shayad","Sony Music Entertainment India Pvt. Ltd.",1,52,138,"1229477"
49,"spotify:track:1ZiReD9pPTttQWwSoYqdyH","Dikshant","Aankhon Se Batana","Sony Music Entertainment India Pvt. Ltd.",38,47,20,"1214859"
51,"spotify:track:6KtSNVgCmQEvDgIuHoXAkT","Azaan Sami Khan","Ik Lamha","Freebird Records",36,46,11,"1198700"
52,"spotify:track:32LKwbmh6yVsWoRRF8DIvf","Pav Dharia","Na Ja","Ishtar Punjabi",50,69,44,"1183699"
53,"spotify:track:043SPVu75TXbs94ZfM9dfn","Kaushik-Guddu, Raghav Chaitanya, Kunaal Vermaa","Dil (From ""Ek Villain Returns"")","T-Series",20,48,9,"1173089"
54,"spotify:track:5iCY0TXNImK4hyKfcplQsg","Anuv Jain","Baarishein","Universal Music India Pvt. Ltd. (on behalf of Anuv Jain)",54,63,69,"1156724"
55,"spotify:track:58f4twRnbZOOVUhMUpplJ4","AP Dhillon, Gminxr, Gurinder Gill, Shinda Kahlon","Brown Munde","Run-up Records",1,57,94,"1155005"
56,"spotify:track:6FQQiTpYnfc5803p84bQp1","Anirudh Ravichander","Vikram - Title Track","Sony Music Entertainment India Pvt. Ltd.",5,54,17,"1147326"
57,"spotify:track:7MXVkk9YMctZqd1Srtv4MB","The Weeknd, Daft Punk","Starboy","Universal Republic Records",57,59,58,"1142453"
58,"spotify:track:5urYiIXu1ZhfMAOsp7WDTc","Rajat Nagpal, Yasser Desai, Neha Kakkar, Rana Sotal","Dil Ko Karaar Aaya (From ""Sukoon"")","Desi Music Factory",3,53,68,"1141670"
59,"spotify:track:3BVjPpVvki8Jpm1Ew21UjH","Vishal Chandrashekhar, S.P. Charan","Inthandham (From ""Sita Ramam (Telugu)"")","Sony Music Entertainment India Pvt. Ltd.",30,38,5,"1141522"
61,"spotify:track:4381FmKZc1uT2zzhBiknH7","A.R. Rahman, Vagu Mazan, Thoughtsfornow","Adheeraa (From ""Cobra"")","Sony Music Entertainment India Pvt. Ltd.",61,109,4,"1132128"
62,"spotify:track:5pcmtf1lwrMqmAWWm248fY","AP Dhillon, Gurinder Gill","DESIRES","RUN-UP RECORDS",2,62,42,"1111750"
63,"spotify:track:3yV2c3cYhkAwSsxAq6nRiv","Gajendra Verma","Mann Mera","Sony Music / Eros Now Music",42,55,77,"1107828"
64,"spotify:track:7eNSk0grNnO7MqjLZzs6MM","Mithoon, Arijit Singh, Neeti Mohan, Karan Malhotra","Fitoor","YRF Music",12,50,9,"1093580"
65,"spotify:track:7ef4DlsgrMEH11cDZd32M6","Calvin Harris, Dua Lipa","One Kiss (with Dua Lipa)","Sony Music UK",56,60,15,"1079166"
66,"spotify:track:3gOXq3FPPesm7VLPKmef6j","Arijit Singh, Shashaa Tirupati","Rait Zara Si","T-Series",12,58,40,"1076413"
67,"spotify:track:2kOH2QZB7F7I1iVXqwKuBF","Dhanush, Anirudh Ravichander","Mayakkama Kalakkama (From ""Thiruchitrambalam"")","Sun Pictures",67,131,2,"1054006"
68,"spotify:track:0aA3jlllhKSEiXTmGPGSWz","Jeetu Sharma, Abhilipsa Panda","Har Har Shambhu Shiv Mahadeva","Jeetu Sharma Productions",15,56,11,"1048040"
69,"spotify:track:0VjIjW4GlUZAMYd2vXMi3b","The Weeknd","Blinding Lights","Republic Records",4,68,145,"1040024"
70,"spotify:track:5uHy68Q7ZWe8Qq9k7EAprS","Karan Aujla","Sheesha","Karan Aujla Music inc",70,155,2,"1032251"
71,"spotify:track:7k6QR9YHyW258yVN6FHO1T","OAFF, Savera, Lothika, Kausar Munir","Doobey","Sony Music Entertainment India Pvt. Ltd.",2,64,33,"1030216"
73,"spotify:track:2tjWCe2W7sgvS3C8NHcdtI","Akhil, Dhvani Bhanushali, Kunaal Vermaa, Abhijit Vaghani","Duniyaa (From ""Luka Chuppi"")","T-Series",1,79,185,"1023792"
74,"spotify:track:3wz2vWhYnnBoFmgMkqtzLy","Chani Nattan, Inderpal Moga","Daku","Kharku Life Records",74,110,3,"1019821"
75,"spotify:track:5O932cZmzOZGOGZz9RHx20","Pritam, Arijit Singh","Khairiyat","T-Series",1,76,157,"1000926"
76,"spotify:track:5RrOyaV2xOAnf62uWj24dB","King","OOPS","Warner Music India",76,135,2,"987207"
77,"spotify:track:2AilvPt1AQ8PixlCKqkjfj","Shubh","Elevated","SHUBH",44,73,36,"982855"
78,"spotify:track:6eYsOcDdB5b6rTO5ubMxeV","Anirudh Ravichander, Jonita Gandhi","Private Party (From ""Don"")","Sony Music Entertainment India Pvt. Ltd.",23,78,19,"980688"
79,"spotify:track:4bD9z9qa4qg9BhryvYWB7c","Pritam, Tochi Raina, Rekha Bhardwaj","Kabira","T-Series",72,85,156,"975312"
80,"spotify:track:2Fv2injs4qAm8mJBGaxVKU","Arijit Singh, Mithoon","Tujhe Kitna Chahne Lage (From ""Kabir Singh"")","T-Series",2,77,171,"973222"
81,"spotify:track:3mZLiEDAHIjZ8ms5Lxq33F","Diljit Dosanjh","Peaches","DILJIT DOSANJH",33,74,8,"971930"
82,"spotify:track:1uJ2czshFLqimctgvsxfv2","A.R. Rahman, A. R. Reihana, Bamba Bakya, Ilango Krishnan","Ponni Nadhi (From ""Ponniyin Selvan Part - 1"")","Tips Industries Ltd",82,86,4,"971627"
83,"spotify:track:5L70RGPJEdooqtrgR7vd6U","Pritam, Arijit Singh, Tulsi Kumar","Hum Nashe Mein Toh Nahin","T-Series",30,67,17,"960249"
84,"spotify:track:6zAvNLJkdyRApUHnlJjKfO","Ali Zafar","Jhoom - R&B Mix","Lightingale Records",20,70,17,"959020"
85,"spotify:track:7mNZUnDWUDidWBFaUpVtOC","Vilen","Chidiya","Universal Music India Pvt Ltd.",4,71,115,"955233"
86,"spotify:track:7oN0Wo7sCVvXPdpxoio3JM","Madhur Sharma, Swapnil Tare, Nusrat Fateh Ali Khan","Kali Kali Zulfon Ke (Lo-Fi)","T-Series",86,-1,1,"935543"
87,"spotify:track:2NTVtNcpC0i1R7LVGaCZCF","Badshah, Nikhita Gandhi","Jugnu","Universal Music India Pvt Ltd.",5,84,45,"935196"
89,"spotify:track:6DefzsWqnwrFrmNVnJxWkS","Asim Azhar, Kunaal Vermaa","Jo Tu Na Mila","Universal Music India Pvt Ltd.",89,101,11,"919987"
90,"spotify:track:1iZLpuGMr4tn1F5bZu32Kb","Harrdy Sandhu","Bijlee Bijlee","Universal Music India Pvt Ltd. – Distribution",2,83,45,"918223"
91,"spotify:track:4gC6xOiJLHTpIARRdmYMaQ","Lipsika Bhashyam, Aditya Iyengar","Ra Ra Reddy I Am Ready","Aditya Music",53,72,7,"911957"
92,"spotify:track:3JkVYvxNoGf2HCWJo61462","Sidhu Moose Wala, Sunny Malton, SOE","Never Fold","Sidhu Moose Wala",13,81,20,"909002"
93,"spotify:track:7eQl3Yqv35ioqUfveKHitE","Pritam, Mohit Chauhan, Irshad Kamil","Tum Se Hi","T-Series",56,90,129,"906119"
94,"spotify:track:0QzuaeCEEOV40Pn7IvKEny","Dhruv","double take","Little Worry/RCA Records",75,82,22,"901657"
95,"spotify:track:0tgVpDi06FyKpA1z0VMD4v","Ed Sheeran","Perfect","Atlantic Records UK",48,88,125,"899910"
96,"spotify:track:4BoFJMLSO3ZoD48KgnslSe","Yashal Shahid","Mere Humsafar (Original Score) [Female Version]","ARY DIGITAL",92,92,7,"887295"
97,"spotify:track:6fhG2KJgwO7CrNflRaRmvp","Ruth B., sped up + slowed, slater","Dandelions - slowed + reverb","Columbia",75,93,28,"879501"
98,"spotify:track:5Z9KJZvQzH6PFmb8SNkxuk","Lil Nas X, Jack Harlow","INDUSTRY BABY (feat. Jack Harlow)","Columbia",6,89,59,"872873"
99,"spotify:track:1J14CdDAvBTE1AJYUOwl6C","Duncan Laurence","Arcade","Universal Music, a division of Universal International Music BV",7,113,81,"872554"
100,"spotify:track:6Ozx2ngGtXrqznTKhKBlrT","Ajay-Atul, Ajay Gogavale","Deva Shree Ganesha","Sony Music Entertainment India Pvt. Ltd.",64,65,4,"870387"
101,"spotify:track:4iEGv5Ne6HuCkFCjzxdWQK","Neeti Mohan","Meri Jaan","Saregama",11,91,28,"868160"
103,"spotify:track:4wCy7erulqUfFQNVaZBD9b","Anirudh Ravichander","Once Upon a Time","Sony Music Entertainment India Pvt. Ltd.",12,80,16,"857592"
104,"spotify:track:3eH3HTKPBmxvbT7OgxjNit","Vishal Chandrashekhar, Anurag Kulkarni, Sinduri Vishal","Kaanunna Kalyanam (From ""Sita Ramam (Telugu)"")","Sony Music Entertainment India Pvt. Ltd.",59,75,5,"852411"
105,"spotify:track:7sVEoPc5ZUUQerRkgTypUZ","Javed Ali, Devi Sri Prasad","Srivalli (From ""Pushpa The Rise Part - 01"")","T-Series",4,98,33,"851692"
106,"spotify:track:3OK2VUpcjQQZAqGHw95N4G","Prem Dhillon","26 Blvd","Prem Dhillon",54,100,4,"849068"
107,"spotify:track:1Hdz67JES35Z4h3Yd4PXvV","Thaman S, Anirudh Ravichander, Ramya Behara, Sahithi Chaganti, Vivek","Bimbilikki Pilapi (From ""Prince "")(Tamil)","Aditya Music",107,-1,1,"845332"
108,"spotify:track:0pqnGHJpmpxLKifKRmU6WP","Imagine Dragons","Believer","Kid Ina Korner / Interscope",25,94,185,"845111"
109,"spotify:track:5OcGETO7eEKjKme4gm0r7y","Pritam, Arijit Singh, Amitabh Bhattacharya","Dance Ka Bhoot (From ""Brahmastra"")","Sony Music Entertainment India Pvt. Ltd.",109,187,2,"844354"
110,"spotify:track:7qiZfU4dY1lWllzX7mPBI3","Ed Sheeran","Shape of You","Atlantic Records UK",63,96,122,"843793"
111,"spotify:track:5G7pZ8G8NFvS1MQ9H4L7dC","Javed-Mohsin, Arijit Singh, Shreya Ghoshal, Kunaal Vermaa, Prashant Ingole","Pal","Sony Music Entertainment India Pvt. Ltd.",44,114,183,"833346"
112,"spotify:track:7Mi0pugIa9VPQm7ykGWIfa","Devi Sri Prasad, Silambarasan TR, Haripriya, Shree Mani","Bullet song (From ""The Warriorr"")(Telugu)","Aditya Music",70,95,16,"830761"
113,"spotify:track:3dPlLOjFnKpGpakkhPEIgF","Prem Dhillon","OG","Prem Dhillon",80,105,4,"824846"
114,"spotify:track:3B4etxytImrRKQgV3XHjnR","Katy Perry","Harleys In Hawaii","Capitol Records",32,122,56,"824495"
115,"spotify:track:3fwyItGexa88kR8j76dIqv","Pratsofficial","Aziyat 2.0 - Reprise Version","Prats",85,120,13,"824158"
116,"spotify:track:209pScL6fUhISxcLWkB6rf","Anirudh Ravichander","Lokiverse - Background Score","Sony Music Entertainment India Pvt. Ltd.",37,99,9,"818536"
117,"spotify:track:6I3mqTwhRpn34SLVafSH7G","Justin Bieber","Ghost","RBMG/Def Jam",72,133,48,"809472"
118,"spotify:track:6v3KW9xbzN5yKLt9YKDYA2","Shawn Mendes, Camila Cabello","Señorita","Island Records",1,115,168,"807634"
119,"spotify:track:4OcvkkpF3xmyCGGY5IBlgi","Akhil Sachdeva, Tulsi Kumar","Tera Ban Jaunga (From ""Kabir Singh"")","T-Series",4,152,160,"804758"
120,"spotify:track:2PcGqmKToUz0s65q1Acg7d","AP Dhillon, Shinda Kahlon, Gminxr","SPACESHIP","RUN-UP RECORDS",15,125,42,"801192"
121,"spotify:track:3iH9MTX6mSGgSNlw9Q2T6t","Hrithik Jayakish, Neha Girish, Eshaan Sanil, Thejas Krishna, Vishnu Vijay, Mu.Ri","Thallumaala Paattu - From ""Thallumaala""","Muzik247",66,128,4,"796829"
122,"spotify:track:6TClJ8jXi3OBV7gcrU3jx5","AP Dhillon, Gurinder Gill","TERE TE","RUN-UP RECORDS",7,129,42,"796036"
123,"spotify:track:0u2P5u6lvoDfwTYjAADbn4","Billie Eilish, Khalid","lovely (with Khalid)","Darkroom",23,121,179,"795070"
124,"spotify:track:3Vb8KkT6Ub5fFGPYJCJyLh","Anirudh Ravichander","Rolex Theme - Background Score","Sony Music Entertainment India Pvt. Ltd.",25,112,9,"793480"
125,"spotify:track:3APdIdF8H0jsxSuGOqXedS","Rashid Ali","Kabhi Kabhi Aditi","T-Series",86,107,47,"786038"
127,"spotify:track:0loZn1c5heXie7OAtvK6nH","Jubin Nautiyal, Rocky - Shiv","Humnava Mere","T-Series",86,116,79,"777715"
128,"spotify:track:6xGruZOHLs39ZbVccQTuPZ","Joji","Glimpse of Us","88rising Music",19,103,12,"774940"
129,"spotify:track:2PvaburAUlhNHxVhw5lvOq","Arijit Singh","Humdard (From ""Ek Villain"")","T-Series",93,143,112,"771942"
130,"spotify:track:0tpwqQhdfJXRcUDSNRjb9O","Arijit Singh, Neeti Mohan, Rashmi Virag","Mere Yaaraa (From ""Sooryavanshi"")","T-Series",20,123,45,"765855"
131,"spotify:track:0NvGVd87SYZnryTcfQPKUO","Madhur Sharma","Kali Kali Zulfon Ke","Universal Music India Pvt Ltd.",87,111,14,"764112"
132,"spotify:track:43YkTTlOD203o9E5ZxhUjF","Arijit Singh","Main Dhoondne Ko Zamaane Mein (From ""Heartless"")","T-Series",94,127,56,"756841"
133,"spotify:track:7ouBSPZKQpm7zQz2leJXta","Arijit Singh","Tum Hi Ho (From ""Aashiqui 2"")","T-Series",78,132,84,"756809"
134,"spotify:track:4wMpv5KCDYSCQ0rWwKON0E","Haricharan, Benny Dayal, Salim Kumar, Vishnu Vijay, Mu.Ri","Ole Melody - From ""Thallumaala""","Muzik247",121,159,3,"754003"
135,"spotify:track:1w3exvIgbRFV2ijf6qyWm8","Sidhu Moose Wala","Everybody Hurts","Sidhu Moose Wala",18,124,19,"753960"
137,"spotify:track:65orA4uL6HAdy9j9VeXxFC","Jakes Bejoy, Athul Narukara, Sreehari Tharayil, Santhosh Varma","Pala Palli (From ""Kaduva"")","Magic Frames Music",137,-1,2,"751693"
138,"spotify:track:0tPGKwBnhD2pxeUoGxpZYB","Khan Bhaini","Numb","Times Music – Speed Records",138,153,2,"750197"
139,"spotify:track:2VrSkfinwUSNc7uAXiL0FA","ShaSings, Xtreeemit","Let Me Down Slowly / Mai Dhoondhne Ko Zamaney / Kabhi Jo Badal Barsey (Medley)","ShaSings",123,141,5,"746086"
140,"spotify:track:3NpbGCDrcQTERaZb5dHhd3","Guru Randhawa, Asees Kaur, Vishal Shelke","Nain Ta Heere (From ""Jugjugg Jeeyo"")","T-Series",104,130,10,"743159"
142,"spotify:track:0lYBSQXN6rCTvUZvg9S0lU","DJ Snake, Justin Bieber","Let Me Love You","DJ Snake Def Jam",90,147,185,"734091"
143,"spotify:track:48QmG1dfvMuYLxMPt7KSRA","Sean Paul, Dua Lipa","No Lie","Universal-Island Records Ltd.",19,126,43,"731769"
144,"spotify:track:3qrdLVOClRU4yPkcXZ7c5u","Ayushmann Khurrana, Tanishk-Vayu","Mere Liye Tum Kaafi Ho (From ""Shubh Mangal Zyada Saavdhan"")","T-Series",11,163,134,"729749"
145,"spotify:track:5D507IC1VOAg7bKkmOblr6","Anirudh Ravichander, Adithya RK","Bae (From ""Don"")","Sony Music Entertainment India Pvt. Ltd.",50,119,31,"722583"
146,"spotify:track:0dLbrlAVPPjpPqnYfmJsWk","Atif Aslam, Alisha Chinai, Pritam","Tera Hone Laga Hoon","Tips Industries Ltd",83,162,69,"720244"
147,"spotify:track:1W1dS4VnIrYnllQJ3CAcZy","Sidhu Moose Wala","So High","Humble Music",38,139,15,"717704"
148,"spotify:track:4HdzYTQiouB9BVYX7JOrhh","Anirudh Ravichander, Rokesh","Jalabulajangu (From ""Don"")","Sony Music Entertainment India Pvt. Ltd.",21,142,38,"716723"
149,"spotify:track:7cWnks0lsRtpAi87COOiXK","Salim–Sulaiman, Rahat Fateh Ali Khan, Jaideep Sahni","O Re Piya","YRF Music",125,134,3,"715223"
150,"spotify:track:3sqRODOZ1Z6hR4F2tnFAlg","Maninder Buttar","Sakhiyaan","Ishtar Punjabi",20,136,175,"710381"
151,"spotify:track:0xzI1KAr0Yd9tv8jlIk3sn","benny blanco, BTS, Snoop Dogg","Bad Decisions (with BTS & Snoop Dogg)","Friends Keep Secrets/Interscope Records",36,97,5,"707731"
152,"spotify:track:1hYaQRlsuEW4kMjjmjyow3","Vishal Chandrashekhar, S.P. Charan, Ramya Behara","Oh Sita Hey Rama (From ""Sita Ramam (Telugu)"")","Sony Music Entertainment India Pvt. Ltd.",91,117,5,"701591"
153,"spotify:track:6XPmY4hIb1RGRyNuq0UBsl","The PropheC","Kina Chir","PropheC Productions",12,161,46,"697765"
155,"spotify:track:3C9kY7XZh6GCEmfazGJ2UB","Serena","Safari","Ultra Records, LLC",82,160,83,"696063"
156,"spotify:track:1AzNN19lPYC68iacrbWL8X","Darbuka Siva, Sid Sriram","Mudhal Nee Mudivum Nee Title Track (From ""Mudhal Nee Mudivum Nee"")","Sony Music Entertainment India Pvt. Ltd.",24,149,32,"695231"
157,"spotify:track:70wFZWY6cKFxp3Qcq8uxH4","King","Ektarfa","Warner Music India",51,137,14,"692921"
158,"spotify:track:6PO6EnP2QoP4vN27KmKvrj","Prem Dhillon","Nah They Can't","Prem Dhillon",88,118,4,"692380"
159,"spotify:track:6FjbAnaPRPwiP3sciEYctO","Pritam, Arijit Singh","Raabta","T-Series",144,178,15,"691878"
160,"spotify:track:3ZGJhN4unVspOqpwGvUL2W","Diljit Dosanjh","Lemonade","DILJIT DOSANJH",93,-1,6,"691191"
161,"spotify:track:6udC4b4jOSnHb9ItnXgKLR","Sachin-Jigar, Shreya Ghoshal, Tochi Raina","Saibo","Sony Music Entertainment India Pvt. Ltd.",65,158,97,"689781"
162,"spotify:track:1u8c2t2Cy7UBoG4ArRcF5g","Taylor Swift","Blank Space","Big Machine Records, LLC",69,154,94,"688074"
163,"spotify:track:7hU3IHwjX150XLoTVmjD0q","LISA","MONEY","YG Entertainment/Interscope Records",6,151,52,"682694"
164,"spotify:track:3RiPr603aXAoi4GHyXx0uy","Coldplay","Hymn for the Weekend","Parlophone UK",118,144,20,"678984"
165,"spotify:track:3e7sxremeOE3wTySiOhGiP","ZAYN, Sia","Dusk Till Dawn (feat. Sia) - Radio Edit","RCA Records Label",51,156,153,"677586"
166,"spotify:track:1SOClUWhOi8vHZYMz3GluK","Jaymes Young","Infinity","Atlantic Records",22,150,40,"676971"
167,"spotify:track:57jOEZtoLQK4zF2x55bdkp","Rochak Kohli, Arijit Singh, Neha Kakkar","Tu Hi Yaar Mera (From ""Pati Patni Aur Woh"")","T-Series",8,166,144,"676923"
168,"spotify:track:41UQTit03jSLz0DoUZ3Eux","Shrylox","Aarmabh Hai Prachand X Polozehnie","Shrylox",165,173,5,"670002"
169,"spotify:track:2ZRo7axmMPeSVUvDbGkJah","XXXTENTACION","Hope","Bad Vibes Forever, LLC",44,171,67,"667711"
170,"spotify:track:6gwnKOvdBKkTU4CQ7KpIAu","Shaarib Toshi, Arijit Singh","Bandeya - From ""Dil Juunglee""","Pooja Music",131,-1,13,"662941"
171,"spotify:track:7BKLCZ1jbUBVqRi2FVlTVw","The Chainsmokers, Halsey","Closer","Disruptor Records/Columbia",59,165,185,"661283"
172,"spotify:track:0ojpEubhy4JNeVftmVuiN7","Vishal Mishra, Armaan Malik","Pehla Pyaar","T-Series",11,-1,67,"658288"
173,"spotify:track:3Vmo13MxVRKBszmfK61ONH","Karan Aujla, YG","Gangsta","Rehaan Records",21,168,18,"658116"
174,"spotify:track:5EYZZvmNAH5VZCwuzYJqoA","Jatin-Lalit, Shaan, Kailash Kher, Prasoon Joshi","Chand Sifarish","YRF Music",98,195,31,"656338"
175,"spotify:track:4vWcMkEsnEeolYB5kUmr9Q","Hesham Abdul Wahab, Darshana Rajendran","Darshana","Think Music",75,-1,30,"655569"
176,"spotify:track:4wIWWEhbdgKAxhR68eE0Ye","Arijit Singh, Chinmayi","Mast Magan (From ""2 States"")","T-Series",75,169,81,"655500"
177,"spotify:track:4gvrJnKCKIPiacNsWVQwEU","CKay, Dj Yo!, AX'EL","love nwantiti (feat. Dj Yo! & AX'EL) - Remix","WM South Africa",4,164,51,"653778"
178,"spotify:track:3eFoAIpRrhGCEISQxnoNFI","Yuvan Shankar Raja, Aditi Shankar","Madura Veeran","Sony Music Entertainment India Pvt. Ltd.",78,138,4,"652538"
179,"spotify:track:1E16f7KcZmuXuhlenRwA2m","VIBIE, Sachin-Jigar, Shreya Ghoshal, Tochi Raina, Bollywood Lofi","Saibo - Lofi Flip","Sony Music Entertainment India Pvt. Ltd.",175,-1,3,"650104"
180,"spotify:track:0XwRlvv3KlOu4HWlOH34XG","Diljit Dosanjh","Lover","Diljit Dosanjh",13,176,55,"650097"
181,"spotify:track:4L6hCEc9xFf01U4d66JzK0","Armaan Malik","Tu / You","Arista Records",110,148,6,"647436"
182,"spotify:track:69xohKu8C1fsflYAiSNbwM","BTS","Run BTS","BIGHIT MUSIC",17,145,13,"638747"
183,"spotify:track:5cF0dROlMOK5uNZtivgu50","Charlie Puth","Attention","Artist Partner",110,186,118,"633149"
184,"spotify:track:0a6zRnrjmaOcqsEIFkXIhw","Akhil","Khaab","Crown Records",101,157,128,"632218"
185,"spotify:track:68EMU2RD1ECNeOeJ5qAXCV","Charlie Puth, Selena Gomez","We Don't Talk Anymore (feat. Selena Gomez)","Artist Partner",77,172,112,"630133"
186,"spotify:track:4iFPsNzNV7V9KJgcOX7TEO","Atif Aslam, Pritam","Tu Jaane Na","Tips Industries Ltd",108,192,73,"629171"
187,"spotify:track:0H2iJVgorRR0ZFgRqGUjUM","Pritam, Arijit Singh","Channa Mereya","Sony Music Entertainment India Pvt. Ltd.",58,182,150,"627436"
188,"spotify:track:6H7fLdt0AeWpuxUKXuXWrx","Hariharan","Shree Hanuman Chalisa","T-Series",188,189,5,"627107"
189,"spotify:track:1Ef0TmgS1QrVO6tKHrMMmH","Vishal-Shekhar, Arijit Singh, Shilpa Rao, Kumaar","Ghungroo (From ""War"")","YRF Music",1,183,148,"626700"
190,"spotify:track:09mEdoA6zrmBPgTEN5qXmN","The Weeknd","Call Out My Name","Universal Republic Records",190,-1,1,"626031"
191,"spotify:track:5ZhKD46Q7mhsl0awl7ZMJc","Sachin-Jigar, Atif Aslam","Jeena Jeena","Eros Now Music",90,180,63,"623517"
192,"spotify:track:3CIyK1V4JEJkg02E4EJnDl","Imagine Dragons, JID, Arcane, League of Legends","Enemy (with JID) - from the series Arcane League of Legends","Kid Ina Korner / Interscope",31,174,38,"621556"
193,"spotify:track:6qZyM6JV8ohLC4S2EL5sFh","Sachet Tandon, Nikhita Gandhi, Madhubanti Bagchi, Sachin-Jigar","Barbaadiyan","T-Series",14,190,49,"618808"
194,"spotify:track:5QDLhrAOJJdNAmCTJ8xMyW","BTS","Dynamite","BIGHIT MUSIC",1,177,107,"613926"
195,"spotify:track:3HiobOOpSpMsi95WBKPBYk","Jeet Gannguli, Arijit Singh","Hamari Adhuri Kahani (Title Track)","Sony Music Entertainment India Pvt. Ltd.",168,196,43,"613230"
196,"spotify:track:1NX33DecZrq4ZUGDc47AfN","Arijit Singh","Tera Yaar Hoon Main (From ""Sonu Ke Titu Ki Sweety"")","T-Series",54,188,179,"612615"
197,"spotify:track:2zZTXtLqCsICzEcztKjn47","Neeraj Shridhar, Kavita Seth, Pritam","Tum Hi Ho Bandhu","Eros Now Music",184,-1,5,"612155"
198,"spotify:track:5iUbq311UD3MZYmfi2a1Ob","Anirudh Ravichander","Pablo Sandhanam - Background Score","Sony Music Entertainment India Pvt. Ltd.",89,-1,8,"611169"
199,"spotify:track:1UWacd8x8tPPwmrPB1MoBI","Pritam, Arijit Singh","Ae Dil Hai Mushkil Title Track","Sony Music Entertainment India Pvt. Ltd.",105,198,136,"609879"
200,"spotify:track:2RgvvnMwtP0R2OkVZmFvnV","KK","Ajab Si (From ""Om Shanti Om"")","T-Series",46,191,35,"605117"
