rank,uri,artist_names,track_name,source,peak_rank,previous_rank,weeks_on_chart,streams
190,"spotify:track:0OBv4CEP5FKS19ZQGHAUM6","Mc Paiva ZS, DJ Ak beats, Love Funk","Fala na Cara","Love Funk",85,-1,26,"1113854"
191,"spotify:track:6nvbXA95vgyThzj2Tbhank","Mc Ws da leste, MC Cothiê, Dj Chadin do C","Tipo Hollywood","Fera Entretenimento",2,176,34,"1109475"
192,"spotify:track:6vvPecFTmWxDfEJ6cYT1wa","LISA","Rockstar","Lloud Co./RCA Records",124,124,2,"1108042"
193,"spotify:track:4fgnNikmEUvXze89h3X47m","NATTAN","Morena","Nattan",31,161,27,"1104097"
194,"spotify:track:0h7m2GwOZFptFrg7e7tiTn","Mc Kelvinho, MC Hariel, MC Ryan SP, MC Neguinho do Kaxeta, Mc Daniel, Kyan","Avisa Lá, Pt. 4","GR6 Music",101,180,9,"1102795"
195,"spotify:track:5g7sDjBhZ4I3gcFIpkrLuI","Bruno Mars","Locked out of Heaven","Atlantic Records",67,136,32,"1102537"
196,"spotify:track:0EMf4CzvPd1z50iqRbmLfl","Maria Marçal","Deixa","MK Music",136,198,38,"1101536"
197,"spotify:track:0mVTQi9I4ehzSi9u9hLca5","João Neto & Frederico, Hugo & Guilherme","Saudade Sem Educação - Ao Vivo","Virgin Music Label And Artist Services (S&D)",197,-1,1,"1101201"
198,"spotify:track:4WXVqLSRHF4ypdiBngbcqU","Dj GM, Mc Paiva ZS, Triz, MC Paulin da Capital, Mc Lipi, Mc Lele JP, MC Ryan SP, Gabb MC, Mc Daniel, MC Cebezinho, MC GH do 7, MC Marks, GREGO, Mc Negão Original","Set Dj Gm 6.0","Love Funk",90,190,27,"1097670"
199,"spotify:track:5RHOhXxMVhpEaBcG6hIydA","KayBlack, Wall Hein, AMUSIK","Maturidade","Elenko Music",62,107,41,"1096585"
200,"spotify:track:4uLzGOlqSanpNS3htaUViY","Zé Neto & Cristiano","Pátio do Posto - Ao Vivo","Som Livre",19,-1,62,"1095232"
