rank,uri,artist_names,track_name,source,peak_rank,previous_rank,weeks_on_chart,streams
1,"spotify:track:6VBhH7CyP56BXjp8VsDFPZ","Pritam, Arijit Singh, Amitabh Bhattacharya","Kesariya (From ""Brahmastra"")","Sony Music Entertainment India Pvt. Ltd.",1,1,4,"9786250"
2,"spotify:track:7lvDsmTRXFE3dK4OjvRiWB","Shae Gill, Ali Sethi","Pasoori","Giraffe Pakistan",1,2,25,"4950939"
3,"spotify:track:08Isz2ETWSBhvIl8UpKYsp","Shubh","No Love","SHUBH",2,3,22,"3789075"
4,"spotify:track:29m79w9xPMH4YCD6r8JSmV","AP Dhillon, Gurinder Gill, Intense","Excuses","RUN-UP RECORDS",1,4,42,"2953455"
5,"spotify:track:5W7DOVGQLTigu09afW7QMT","Sidhu Moose Wala","295","Sidhu Moose Wala",1,5,26,"2539508"
6,"spotify:track:0snQrp1VaY5Pj1YIHRJpRJ","Aditya A","Chaand Baaliyan","Sony Music Entertainment India Pvt. Ltd.",2,7,25,"2199768"
7,"spotify:track:0yCWDaAgOtg6TKlNCg9rwA","King","Tu Aake Dekhle","Warner Music India",6,6,80,"2173950"
9,"spotify:track:6TQS7URegxmcb8tTNpoXzi","Dhanush, Anirudh Ravichander","Megham Karukatha (From ""Thiruchitrambalam"")","Sun Pictures",9,17,3,"2056111"
10,"spotify:track:1aL9518P5G72N92b48tuKw","AP Dhillon","Summer High","RUN-UP RECORDS",10,-1,1,"2005538"
11,"spotify:track:6ZYxNjuAU9Vy3VtF6W1dtE","Shubh","We Rollin","SHUBH",10,12,37,"1971014"
12,"spotify:track:2rOnSn2piaqLAlYjtfUBlY","Tanishk Bagchi, Jubin Nautiyal, Asees Kaur","Raataan Lambiyan (From ""Shershaah"")","Sony Music Entertainment India Pvt. Ltd.",1,10,54,"1941855"
13,"spotify:track:02MWAaffLxlfxAUY7c5dvx","Glass Animals","Heat Waves","Polydor Records",3,13,56,"1834771"
14,"spotify:track:2eAvDnpXP5W0cVtiI0PUxV","Ruth B.","Dandelions","Columbia",14,15,37,"1830783"
15,"spotify:track:0aA3jlllhKSEiXTmGPGSWz","Jeetu Sharma, Abhilipsa Panda","Har Har Shambhu Shiv Mahadeva","Jeetu Sharma Productions",15,52,7,"1822025"
16,"spotify:track:2FZDNh6tm9mkZ9vTphuAh8","Pritam, Tanishk Bagchi, Neeraj Shridhar","Bhool Bhulaiyaa 2 Title Track","T-Series",7,11,15,"1815509"
17,"spotify:track:2eTkxblLeqdTSsb2ivafDX","Ankit Tiwari, Manoj Muntashir","Galliyan Returns (From ""Ek Villain Returns"")","T-Series",9,9,6,"1794779"
19,"spotify:track:7B4uYqxTpTOS1sgxFB9Ann","Sidhu Moose Wala, Wazir Patar","The Last Ride","Sidhu Moose Wala",3,19,13,"1699794"
20,"spotify:track:72zHuDxFQTjbL51qJQSA7j","Jasleen Royal, B Praak, Romy","Ranjha (From ""Shershaah"")","Sony Music Entertainment India Pvt. Ltd.",1,18,53,"1698062"
21,"spotify:track:7eNSk0grNnO7MqjLZzs6MM","Mithoon, Arijit Singh, Neeti Mohan, Karan Malhotra","Fitoor","YRF Music",12,16,5,"1678530"
22,"spotify:track:0mBP9X2gPCuapvpZ7TGDk3","Charlie Puth, Jung Kook, BTS","Left and Right (Feat. Jung Kook of BTS)","Atlantic Records",4,22,7,"1672410"
23,"spotify:track:043SPVu75TXbs94ZfM9dfn","Kaushik-Guddu, Raghav Chaitanya, Kunaal Vermaa","Dil (From ""Ek Villain Returns"")","T-Series",20,20,5,"1639434"
24,"spotify:track:4Dvkj6JhhA12EX05fT7y2e","Harry Styles","As It Was","Columbia",5,23,19,"1604607"
25,"spotify:track:6yvxu91deFKt3X1QoV6qMv","Anirudh Ravichander, Jonita Gandhi","Arabic Kuthu - Halamithi Habibo (From ""Beast"")","Sun Pictures",2,21,26,"1604503"
26,"spotify:track:58HvfVOeJY7lUuCqF0m3ly","Elley Duhé","MIDDLE OF THE NIGHT","Not Fit For Society/RCA Records",12,27,32,"1574774"
27,"spotify:track:5O2P9iiztwhomNh8xkR9lJ","One Direction","Night Changes","Syco Music",23,26,65,"1566609"
28,"spotify:track:60YICjIPdL7LDBcCMK0tAk","Sidhu Moose Wala, Sunny Malton, The Kidd","Levels","Sidhu Moose Wala",8,28,11,"1559604"
29,"spotify:track:5WWplXimzIjlJiN2N7T9Q3","Anirudh Ravichander, Kamal Haasan","Pathala Pathala (From ""Vikram"")","Sony Music Entertainment India Pvt. Ltd.",6,25,13,"1497161"
30,"spotify:track:0stbF4C1ACmIvx0aW81ZXa","Nakash Aziz, Sunidhi Chauhan","Ra Ra Rakkamma (From ""Vikrant Rona"")","Lahari Music",30,30,5,"1490787"
31,"spotify:track:6FQQiTpYnfc5803p84bQp1","Anirudh Ravichander","Vikram - Title Track","Sony Music Entertainment India Pvt. Ltd.",5,24,13,"1482690"
32,"spotify:track:5PjdY0CKGZdEuoNab3yDmX","The Kid LAROI, Justin Bieber","STAY (with Justin Bieber)","Columbia",1,32,57,"1396581"
33,"spotify:track:2FCXQHugkoHE1K3tiDu8pu","Alka Yagnik, Arijit Singh","Agar Tum Saath Ho (From ""Tamasha"")","T-Series",4,31,167,"1385169"
34,"spotify:track:2vkNA9I029dTwX0y6d59Sc","Anirudh Ravichander, Anthony Daasan","Dippam Dappam (From ""Kaathuvaakula Rendu Kaadhal"")","Sony Music Entertainment India Pvt. Ltd.",13,35,16,"1365490"
35,"spotify:track:3mZLiEDAHIjZ8ms5Lxq33F","Diljit Dosanjh","Peaches","DILJIT DOSANJH",33,33,4,"1363894"
36,"spotify:track:0xzI1KAr0Yd9tv8jlIk3sn","benny blanco, BTS, Snoop Dogg","Bad Decisions (with BTS & Snoop Dogg)","Friends Keep Secrets/Interscope Records",36,-1,1,"1359405"
37,"spotify:track:1y1rQTkWmrZdJmjwuK07GC","Vishal Mishra, Manoj Muntashir","Kaise Hua (From ""Kabir Singh"")","T-Series",5,34,165,"1342930"
38,"spotify:track:0DXfJ2iKRDEG7rPgssWFea","Kanishk Seth, Kavita Seth","Rangisari (From ""Jugjugg Jeeyo"")","T-Series",22,29,9,"1303096"
39,"spotify:track:2J2Z1SkXYghSajLibnQHOa","Sia","Unstoppable","Monkey Puzzle Records/RCA Records",16,36,54,"1294002"
40,"spotify:track:2qxmye6gAegTMjLKEBoR3d","Alec Benjamin","Let Me Down Slowly","2018",34,40,122,"1279387"
41,"spotify:track:2l3dFxtoSMgMQVyRIUHjpz","Mitraz","Akhiyaan","Mitraz Records",23,39,15,"1270866"
42,"spotify:track:6zAvNLJkdyRApUHnlJjKfO","Ali Zafar","Jhoom - R&B Mix","Lightingale Records",20,37,13,"1256735"
43,"spotify:track:1ZiReD9pPTttQWwSoYqdyH","Dikshant","Aankhon Se Batana","Sony Music Entertainment India Pvt. Ltd.",38,41,16,"1247893"
44,"spotify:track:2tMoOS9grHtn4upzb4LwMG","Dhibu Ninan Thomas, Kapil Kapilan","Adiye - From ""Bachelor""","Think Music",16,42,36,"1206844"
45,"spotify:track:3UhmuWcFaLS3AO3kI9ynQ2","AP Dhillon, Shinda Kahlon, Gurinder Gill, Gminxr","Insane","RUN-UP RECORDS",3,50,69,"1203137"
46,"spotify:track:6KtSNVgCmQEvDgIuHoXAkT","Azaan Sami Khan","Ik Lamha","Freebird Records",46,49,7,"1202143"
47,"spotify:track:1smFN2CLqGROu0J0UyvDfL","Pritam, Arijit Singh","Shayad","Sony Music Entertainment India Pvt. Ltd.",1,46,134,"1183665"
48,"spotify:track:0VjIjW4GlUZAMYd2vXMi3b","The Weeknd","Blinding Lights","Republic Records",4,57,141,"1167042"
49,"spotify:track:5urYiIXu1ZhfMAOsp7WDTc","Rajat Nagpal, Yasser Desai, Neha Kakkar, Rana Sotal","Dil Ko Karaar Aaya (From ""Sukoon"")","Desi Music Factory",3,45,64,"1163865"
50,"spotify:track:5L70RGPJEdooqtrgR7vd6U","Pritam, Arijit Singh, Tulsi Kumar","Hum Nashe Mein Toh Nahin","T-Series",30,38,13,"1156077"
51,"spotify:track:78tblPcz2otRZd1VOeU7zz","Yuvan Shankar Raja, Sid Sriram","Kanja Poovu Kannala (From ""Viruman"")","Sony Music Entertainment India Pvt. Ltd.",51,157,9,"1150355"
52,"spotify:track:0T5iIrXA4p5GsubkhuBIKV","Stephen Sanchez","Until I Found You","Republic Records",52,61,15,"1141432"
53,"spotify:track:3gOXq3FPPesm7VLPKmef6j","Arijit Singh, Shashaa Tirupati","Rait Zara Si","T-Series",12,47,36,"1116485"
54,"spotify:track:209pScL6fUhISxcLWkB6rf","Anirudh Ravichander","Lokiverse - Background Score","Sony Music Entertainment India Pvt. Ltd.",37,48,5,"1102676"
55,"spotify:track:6xGruZOHLs39ZbVccQTuPZ","Joji","Glimpse of Us","88rising Music",19,43,8,"1092558"
56,"spotify:track:2AilvPt1AQ8PixlCKqkjfj","Shubh","Elevated","SHUBH",44,55,32,"1081310"
57,"spotify:track:3Vb8KkT6Ub5fFGPYJCJyLh","Anirudh Ravichander","Rolex Theme - Background Score","Sony Music Entertainment India Pvt. Ltd.",25,44,5,"1081050"
58,"spotify:track:3JkVYvxNoGf2HCWJo61462","Sidhu Moose Wala, Sunny Malton, SOE","Never Fold","Sidhu Moose Wala",13,56,16,"1071137"
59,"spotify:track:7ef4DlsgrMEH11cDZd32M6","Calvin Harris, Dua Lipa","One Kiss (with Dua Lipa)","Sony Music UK",59,75,11,"1067892"
60,"spotify:track:58f4twRnbZOOVUhMUpplJ4","AP Dhillon, Gminxr, Gurinder Gill, Shinda Kahlon","Brown Munde","Run-up Records",1,60,90,"1059795"
61,"spotify:track:7mNZUnDWUDidWBFaUpVtOC","Vilen","Chidiya","Universal Music India Pvt Ltd.",4,53,111,"1045759"
62,"spotify:track:4iEGv5Ne6HuCkFCjzxdWQK","Neeti Mohan","Meri Jaan","Saregama",11,54,24,"1044303"
63,"spotify:track:6eYsOcDdB5b6rTO5ubMxeV","Anirudh Ravichander, Jonita Gandhi","Private Party (From ""Don"")","Sony Music Entertainment India Pvt. Ltd.",23,58,15,"1040871"
64,"spotify:track:4gC6xOiJLHTpIARRdmYMaQ","Lipsika Bhashyam, Aditya Iyengar","Ra Ra Reddy I Am Ready","Aditya Music",64,94,3,"1028555"
65,"spotify:track:4wCy7erulqUfFQNVaZBD9b","Anirudh Ravichander","Once Upon a Time","Sony Music Entertainment India Pvt. Ltd.",12,51,12,"1024828"
66,"spotify:track:5pcmtf1lwrMqmAWWm248fY","AP Dhillon, Gurinder Gill","DESIRES","RUN-UP RECORDS",2,71,38,"992160"
67,"spotify:track:5O932cZmzOZGOGZz9RHx20","Pritam, Arijit Singh","Khairiyat","T-Series",1,63,153,"984889"
68,"spotify:track:3F2BSn4ayglzMwquBRHZq6","Kavita Seth, Kanishk Seth","Rangi Saari","Kavita Seth",47,59,30,"978308"
69,"spotify:track:32LKwbmh6yVsWoRRF8DIvf","Pav Dharia","Na Ja","Ishtar Punjabi",50,66,40,"976348"
72,"spotify:track:4bD9z9qa4qg9BhryvYWB7c","Pritam, Tochi Raina, Rekha Bhardwaj","Kabira","T-Series",72,82,152,"963098"
73,"spotify:track:2Fv2injs4qAm8mJBGaxVKU","Arijit Singh, Mithoon","Tujhe Kitna Chahne Lage (From ""Kabir Singh"")","T-Series",2,69,167,"962451"
74,"spotify:track:7Mi0pugIa9VPQm7ykGWIfa","Devi Sri Prasad, Silambarasan TR, Haripriya, Shree Mani","Bullet song (From ""The Warriorr"")(Telugu)","Aditya Music",74,101,12,"957706"
75,"spotify:track:1iZLpuGMr4tn1F5bZu32Kb","Harrdy Sandhu","Bijlee Bijlee","Universal Music India Pvt Ltd. – Distribution",2,79,41,"957331"
76,"spotify:track:7eQl3Yqv35ioqUfveKHitE","Pritam, Mohit Chauhan, Irshad Kamil","Tum Se Hi","T-Series",56,72,125,"952991"
77,"spotify:track:5Z9KJZvQzH6PFmb8SNkxuk","Lil Nas X, Jack Harlow","INDUSTRY BABY (feat. Jack Harlow)","Columbia",6,73,55,"944683"
78,"spotify:track:2NTVtNcpC0i1R7LVGaCZCF","Badshah, Nikhita Gandhi","Jugnu","Universal Music India Pvt Ltd.",5,65,41,"943793"
79,"spotify:track:7k6QR9YHyW258yVN6FHO1T","OAFF, Savera, Lothika, Kausar Munir","Doobey","Sony Music Entertainment India Pvt. Ltd.",2,62,29,"941768"
80,"spotify:track:455lcFHS2MOMKcGquhAf22","Ankit Tiwari, Tara Sutaria","Shaamat (From ""Ek Villain Returns"")","T-Series",80,97,3,"928743"
81,"spotify:track:737gzPI5VAmgUGWiJ9yXuu","Sofía Reyes, Jason Derulo, De La Ghetto","1, 2, 3 (feat. Jason Derulo & De La Ghetto)","WEA Latina",61,67,5,"922473"
82,"spotify:track:3yV2c3cYhkAwSsxAq6nRiv","Gajendra Verma","Mann Mera","Sony Music / Eros Now Music",42,81,73,"920016"
83,"spotify:track:70wFZWY6cKFxp3Qcq8uxH4","King","Ektarfa","Warner Music India",51,74,10,"914924"
84,"spotify:track:0QzuaeCEEOV40Pn7IvKEny","Dhruv","double take","Little Worry/RCA Records",84,100,18,"910737"
85,"spotify:track:7sVEoPc5ZUUQerRkgTypUZ","Javed Ali, Devi Sri Prasad","Srivalli (From ""Pushpa The Rise Part - 01"")","T-Series",4,76,29,"908797"
86,"spotify:track:0tgVpDi06FyKpA1z0VMD4v","Ed Sheeran","Perfect","Atlantic Records UK",48,83,121,"903734"
87,"spotify:track:3eH3HTKPBmxvbT7OgxjNit","Vishal Chandrashekhar, Anurag Kulkarni, Sinduri Vishal","Kaanunna Kalyanam (From ""Sita Ramam (Telugu)"")","Sony Music Entertainment India Pvt. Ltd.",87,-1,1,"902285"
88,"spotify:track:3BVjPpVvki8Jpm1Ew21UjH","Vishal Chandrashekhar, S.P. Charan","Inthandham (From ""Sita Ramam (Telugu)"")","Sony Music Entertainment India Pvt. Ltd.",88,-1,1,"901066"
90,"spotify:track:2tjWCe2W7sgvS3C8NHcdtI","Akhil, Dhvani Bhanushali, Kunaal Vermaa, Abhijit Vaghani","Duniyaa (From ""Luka Chuppi"")","T-Series",1,78,181,"893070"
91,"spotify:track:6fhG2KJgwO7CrNflRaRmvp","Ruth B., sped up + slowed, slater","Dandelions - slowed + reverb","Columbia",75,77,24,"891360"
92,"spotify:track:7MXVkk9YMctZqd1Srtv4MB","The Weeknd, Daft Punk","Starboy","Universal Republic Records",84,84,54,"890756"
93,"spotify:track:0pqnGHJpmpxLKifKRmU6WP","Imagine Dragons","Believer","Kid Ina Korner / Interscope",25,92,181,"864430"
94,"spotify:track:1J14CdDAvBTE1AJYUOwl6C","Duncan Laurence","Arcade","Universal Music, a division of Universal International Music BV",7,91,77,"857574"
95,"spotify:track:7qiZfU4dY1lWllzX7mPBI3","Ed Sheeran","Shape of You","Atlantic Records UK",63,96,118,"851985"
96,"spotify:track:6DefzsWqnwrFrmNVnJxWkS","Asim Azhar, Kunaal Vermaa","Jo Tu Na Mila","Universal Music India Pvt Ltd.",96,106,7,"847792"
97,"spotify:track:1w3exvIgbRFV2ijf6qyWm8","Sidhu Moose Wala","Everybody Hurts","Sidhu Moose Wala",18,86,15,"834165"
98,"spotify:track:6v3KW9xbzN5yKLt9YKDYA2","Shawn Mendes, Camila Cabello","Señorita","Island Records",1,98,164,"822927"
99,"spotify:track:0u2P5u6lvoDfwTYjAADbn4","Billie Eilish, Khalid","lovely (with Khalid)","Darkroom",23,90,175,"819432"
100,"spotify:track:1W1dS4VnIrYnllQJ3CAcZy","Sidhu Moose Wala","So High","Humble Music",38,89,11,"816518"
101,"spotify:track:3phEBDGFZV3sw3rnfMTqXi","Prashant Katheriya","Jiske Aane Se Mukammal","Nawazish Productions",101,117,2,"811754"
102,"spotify:track:0tpwqQhdfJXRcUDSNRjb9O","Arijit Singh, Neeti Mohan, Rashmi Virag","Mere Yaaraa (From ""Sooryavanshi"")","T-Series",20,88,41,"809626"
103,"spotify:track:4BoFJMLSO3ZoD48KgnslSe","Yashal Shahid","Mere Humsafar (Original Score) [Female Version]","ARY DIGITAL",103,108,3,"805431"
104,"spotify:track:3NpbGCDrcQTERaZb5dHhd3","Guru Randhawa, Asees Kaur, Vishal Shelke","Nain Ta Heere (From ""Jugjugg Jeeyo"")","T-Series",104,109,6,"802089"
105,"spotify:track:4HdzYTQiouB9BVYX7JOrhh","Anirudh Ravichander, Rokesh","Jalabulajangu (From ""Don"")","Sony Music Entertainment India Pvt. Ltd.",21,95,34,"801035"
106,"spotify:track:5D507IC1VOAg7bKkmOblr6","Anirudh Ravichander, Adithya RK","Bae (From ""Don"")","Sony Music Entertainment India Pvt. Ltd.",50,93,27,"789328"
107,"spotify:track:3fwyItGexa88kR8j76dIqv","Pratsofficial","Aziyat 2.0 - Reprise Version","Prats",85,85,9,"786413"
108,"spotify:track:6I3mqTwhRpn34SLVafSH7G","Justin Bieber","Ghost","RBMG/Def Jam",72,120,44,"772590"
109,"spotify:track:5iCY0TXNImK4hyKfcplQsg","Anuv Jain","Baarishein","Universal Music India Pvt. Ltd. (on behalf of Anuv Jain)",62,99,65,"771089"
110,"spotify:track:69xohKu8C1fsflYAiSNbwM","BTS","Run BTS","BIGHIT MUSIC",17,103,9,"767451"
112,"spotify:track:5G7pZ8G8NFvS1MQ9H4L7dC","Javed-Mohsin, Arijit Singh, Shreya Ghoshal, Kunaal Vermaa, Prashant Ingole","Pal","Sony Music Entertainment India Pvt. Ltd.",44,114,179,"750130"
113,"spotify:track:48QmG1dfvMuYLxMPt7KSRA","Sean Paul, Dua Lipa","No Lie","Universal-Island Records Ltd.",19,112,39,"748941"
114,"spotify:track:43YkTTlOD203o9E5ZxhUjF","Arijit Singh","Main Dhoondne Ko Zamaane Mein (From ""Heartless"")","T-Series",94,102,52,"748821"
115,"spotify:track:3APdIdF8H0jsxSuGOqXedS","Rashid Ali","Kabhi Kabhi Aditi","T-Series",86,124,43,"747657"
116,"spotify:track:3Vmo13MxVRKBszmfK61ONH","Karan Aujla, YG","Gangsta","Rehaan Records",21,115,14,"745573"
117,"spotify:track:0loZn1c5heXie7OAtvK6nH","Jubin Nautiyal, Rocky - Shiv","Humnava Mere","T-Series",86,123,75,"744533"
118,"spotify:track:4Zzw8CESa97fNrmrvEdIuL","Pritam, Arijit Singh, Amitabh Bhattacharya","Phir Na Aisi Raat Aayegi (From ""Laal Singh Chaddha"")","T-Series",81,105,7,"741932"
119,"spotify:track:3B4etxytImrRKQgV3XHjnR","Katy Perry","Harleys In Hawaii","Capitol Records",32,104,52,"736326"
120,"spotify:track:4L6hCEc9xFf01U4d66JzK0","Armaan Malik","Tu / You","Arista Records",110,110,2,"736014"
121,"spotify:track:7ouBSPZKQpm7zQz2leJXta","Arijit Singh","Tum Hi Ho (From ""Aashiqui 2"")","T-Series",78,113,80,"731627"
122,"spotify:track:0dLbrlAVPPjpPqnYfmJsWk","Atif Aslam, Alisha Chinai, Pritam","Tera Hone Laga Hoon","Tips Industries Ltd",83,118,65,"730543"
123,"spotify:track:2VrSkfinwUSNc7uAXiL0FA","ShaSings, Xtreeemit","Let Me Down Slowly / Mai Dhoondhne Ko Zamaney / Kabhi Jo Badal Barsey (Medley)","ShaSings",123,-1,1,"727888"
124,"spotify:track:5iUbq311UD3MZYmfi2a1Ob","Anirudh Ravichander","Pablo Sandhanam - Background Score","Sony Music Entertainment India Pvt. Ltd.",89,107,5,"723161"
127,"spotify:track:0JBnAsReYppHqCZJbqy5H8","Sidhu Moose Wala, Mxrci","SYL","Sidhu Moose Wala",6,111,7,"718860"
128,"spotify:track:1XSSm7oKOzNE8oUapjIRWV","Tanishk Bagchi, Gippy Grewal, Zahrah S Khan, Romy, Abrar Ul Haq","The Punjaabban Song (From ""Jugjugg Jeeyo"")","T-Series",84,116,10,"718429"
129,"spotify:track:0NvGVd87SYZnryTcfQPKUO","Madhur Sharma","Kali Kali Zulfon Ke","Universal Music India Pvt Ltd.",87,87,10,"716730"
130,"spotify:track:0lYBSQXN6rCTvUZvg9S0lU","DJ Snake, Justin Bieber","Let Me Love You","DJ Snake Def Jam",90,137,181,"709319"
131,"spotify:track:3RiPr603aXAoi4GHyXx0uy","Coldplay","Hymn for the Weekend","Parlophone UK",118,128,16,"705409"
132,"spotify:track:6udC4b4jOSnHb9ItnXgKLR","Sachin-Jigar, Shreya Ghoshal, Tochi Raina","Saibo","Sony Music Entertainment India Pvt. Ltd.",65,127,93,"700551"
133,"spotify:track:4gvrJnKCKIPiacNsWVQwEU","CKay, Dj Yo!, AX'EL","love nwantiti (feat. Dj Yo! & AX'EL) - Remix","WM South Africa",4,131,47,"693792"
134,"spotify:track:2PvaburAUlhNHxVhw5lvOq","Arijit Singh","Humdard (From ""Ek Villain"")","T-Series",93,125,108,"682985"
135,"spotify:track:7BKLCZ1jbUBVqRi2FVlTVw","The Chainsmokers, Halsey","Closer","Disruptor Records/Columbia",59,141,181,"678414"
136,"spotify:track:3sqRODOZ1Z6hR4F2tnFAlg","Maninder Buttar","Sakhiyaan","Ishtar Punjabi",20,149,171,"678124"
137,"spotify:track:6TClJ8jXi3OBV7gcrU3jx5","AP Dhillon, Gurinder Gill","TERE TE","RUN-UP RECORDS",7,180,38,"677627"
138,"spotify:track:57jOEZtoLQK4zF2x55bdkp","Rochak Kohli, Arijit Singh, Neha Kakkar","Tu Hi Yaar Mera (From ""Pati Patni Aur Woh"")","T-Series",8,135,140,"677051"
139,"spotify:track:3qrdLVOClRU4yPkcXZ7c5u","Ayushmann Khurrana, Tanishk-Vayu","Mere Liye Tum Kaafi Ho (From ""Shubh Mangal Zyada Saavdhan"")","T-Series",11,173,130,"676166"
140,"spotify:track:1SOClUWhOi8vHZYMz3GluK","Jaymes Young","Infinity","Atlantic Records",22,121,36,"673529"
141,"spotify:track:3CIyK1V4JEJkg02E4EJnDl","Imagine Dragons, JID, Arcane, League of Legends","Enemy (with JID) - from the series Arcane League of Legends","Kid Ina Korner / Interscope",31,142,34,"671132"
142,"spotify:track:3e7sxremeOE3wTySiOhGiP","ZAYN, Sia","Dusk Till Dawn (feat. Sia) - Radio Edit","RCA Records Label",51,119,149,"668901"
143,"spotify:track:1hYaQRlsuEW4kMjjmjyow3","Vishal Chandrashekhar, S.P. Charan, Ramya Behara","Oh Sita Hey Rama (From ""Sita Ramam (Telugu)"")","Sony Music Entertainment India Pvt. Ltd.",143,-1,1,"667972"
144,"spotify:track:5EYZZvmNAH5VZCwuzYJqoA","Jatin-Lalit, Shaan, Kailash Kher, Prasoon Joshi","Chand Sifarish","YRF Music",98,145,27,"665628"
145,"spotify:track:3C9kY7XZh6GCEmfazGJ2UB","Serena","Safari","Ultra Records, LLC",82,144,79,"664941"
146,"spotify:track:0GQngE2rOYvlKwEQjTAsP8","Pritam, Sreeram, Shilpa Rao","Subhanallah","T-Series",146,170,7,"664624"
147,"spotify:track:0IGXY47K2ha3AHfX57wY1O","Pritam, Arijit Singh, Amitabh Bhattacharya, Jonita Gandhi","Deva Deva (From ""Brahmastra"")","Sony Music Entertainment India Pvt. Ltd.",147,-1,1,"664604"
148,"spotify:track:2PcGqmKToUz0s65q1Acg7d","AP Dhillon, Shinda Kahlon, Gminxr","SPACESHIP","RUN-UP RECORDS",15,146,38,"663826"
149,"spotify:track:4wIWWEhbdgKAxhR68eE0Ye","Arijit Singh, Chinmayi","Mast Magan (From ""2 States"")","T-Series",75,143,77,"659484"
150,"spotify:track:7hU3IHwjX150XLoTVmjD0q","LISA","MONEY","YG Entertainment/Interscope Records",6,132,48,"656724"
151,"spotify:track:77ry49b6wnFaizfe6rFPhe","Pritam, Yo Yo Honey Singh, Armaan Malik, Shashwat Singh, Amitabh Bhattacharya","De Taali","T-Series",90,138,12,"656595"
152,"spotify:track:3ZGJhN4unVspOqpwGvUL2W","Diljit Dosanjh","Lemonade","DILJIT DOSANJH",93,140,4,"655844"
153,"spotify:track:5QDLhrAOJJdNAmCTJ8xMyW","BTS","Dynamite","BIGHIT MUSIC",1,158,103,"655344"
154,"spotify:track:6XPmY4hIb1RGRyNuq0UBsl","The PropheC","Kina Chir","PropheC Productions",12,122,42,"653983"
155,"spotify:track:2ZRo7axmMPeSVUvDbGkJah","XXXTENTACION","Hope","Bad Vibes Forever, LLC",44,153,63,"653978"
156,"spotify:track:6qZyM6JV8ohLC4S2EL5sFh","Sachet Tandon, Nikhita Gandhi, Madhubanti Bagchi, Sachin-Jigar","Barbaadiyan","T-Series",14,129,45,"651694"
157,"spotify:track:1AzNN19lPYC68iacrbWL8X","Darbuka Siva, Sid Sriram","Mudhal Nee Mudivum Nee Title Track (From ""Mudhal Nee Mudivum Nee"")","Sony Music Entertainment India Pvt. Ltd.",24,133,28,"646628"
158,"spotify:track:7BTwRzjCkjMJUEMmXvGPAR","Nej","Paro","Miel Noir",136,136,3,"646429"
159,"spotify:track:7Lcp4QlpR3RDngYejm4fmS","Pritam, Mohan Kannan, Amitabh Bhattacharya","Kahani (From ""Laal Singh Chaddha"")","T-Series",103,160,12,"642886"
160,"spotify:track:0tjnLIbuF8mwLUKq3CNIdH","Sachet Tandon, Parampara Tandon, Sachin-Jigar","Jug Jug Jeeve","T-Series",29,134,39,"641890"
161,"spotify:track:3jf5303mzzJ96O8xFTcEn4","B Praak, Jaani","Mann Bharryaa 2.0 (From ""Shershaah"")","Sony Music Entertainment India Pvt. Ltd.",3,169,52,"639785"
162,"spotify:track:1u8c2t2Cy7UBoG4ArRcF5g","Taylor Swift","Blank Space","Big Machine Records, LLC",69,155,90,"639661"
163,"spotify:track:0XwRlvv3KlOu4HWlOH34XG","Diljit Dosanjh","Lover","Diljit Dosanjh",13,147,51,"637639"
164,"spotify:track:0gPgdRfB4jdGrlyXS0Vx78","Vishal-Shekhar, KK, Shilpa Rao, Anvita Dutt Guptan","Khuda Jaane","YRF Music",37,161,11,"630760"
165,"spotify:track:75FEaRjZTKLhTrFGsfMUXR","Kate Bush","Running Up That Hill (A Deal With God)","Fish People",51,148,10,"629016"
166,"spotify:track:525NKU3UFgZQtCXWBWE0al","Anirudh Ravichander","Sandhanam Theme - Background Score","Sony Music Entertainment India Pvt. Ltd.",50,126,5,"627011"
167,"spotify:track:1Ef0TmgS1QrVO6tKHrMMmH","Vishal-Shekhar, Arijit Singh, Shilpa Rao, Kumaar","Ghungroo (From ""War"")","YRF Music",1,172,144,"623396"
168,"spotify:track:4OcvkkpF3xmyCGGY5IBlgi","Akhil Sachdeva, Tulsi Kumar","Tera Ban Jaunga (From ""Kabir Singh"")","T-Series",4,162,156,"622518"
169,"spotify:track:6FjbAnaPRPwiP3sciEYctO","Pritam, Arijit Singh","Raabta","T-Series",159,171,11,"622115"
170,"spotify:track:46NYX9zIml71qtfYYjakTI","Pritam, Arijit Singh, Amitabh Bhattacharya","Kesariya Audio Teaser (From ""Brahmastra"")","Sony Music Entertainment India Pvt. Ltd.",10,156,17,"620440"
171,"spotify:track:4iFPsNzNV7V9KJgcOX7TEO","Atif Aslam, Pritam","Tu Jaane Na","Tips Industries Ltd",108,151,69,"620023"
173,"spotify:track:3KeMulXbLDJBQdY5PZbGEh","A.R. Rahman, Shreya Ghoshal","Param Sundari","Sony Music Entertainment India Pvt. Ltd.",7,166,56,"618207"
174,"spotify:track:1NX33DecZrq4ZUGDc47AfN","Arijit Singh","Tera Yaar Hoon Main (From ""Sonu Ke Titu Ki Sweety"")","T-Series",54,179,175,"616546"
175,"spotify:track:0H2iJVgorRR0ZFgRqGUjUM","Pritam, Arijit Singh","Channa Mereya","Sony Music Entertainment India Pvt. Ltd.",58,159,146,"614983"
176,"spotify:track:4blqlsA1uf2d2I40E90EUC","Pritam, Arijit Singh, Shilpa Rao","Tere Hawaale (From ""Laal Singh Chaddha"")","T-Series",176,-1,1,"613456"
177,"spotify:track:1pean7zvZUqcWZaUucH63f","Dhanush, Anirudh Ravichander","Thaai Kelavi (From ""Thiruchitrambalam"")","Sun Pictures",177,-1,1,"613227"
178,"spotify:track:4FcknXDJ8yW2QYUl0cm6uJ","Imran Khan","Bewafa","Prestige Records",154,-1,16,"612370"
179,"spotify:track:5cF0dROlMOK5uNZtivgu50","Charlie Puth","Attention","Artist Partner",110,164,114,"609596"
180,"spotify:track:68EMU2RD1ECNeOeJ5qAXCV","Charlie Puth, Selena Gomez","We Don't Talk Anymore (feat. Selena Gomez)","Artist Partner",77,176,108,"608479"
181,"spotify:track:1GzgV0pRSUbenz25xWV2s8","Payal Dev, Badshah","Tauba (feat. Badshah)","Apni Dhun",168,168,2,"608007"
182,"spotify:track:2RgvvnMwtP0R2OkVZmFvnV","KK","Ajab Si (From ""Om Shanti Om"")","T-Series",46,177,32,"605450"
183,"spotify:track:0iJPMG79hgWnDHjufnoplb","Anirudh Ravichander","Porkanda Singam EDM Version (Additional Song)","Sony Music Entertainment India Pvt. Ltd.",83,130,7,"604818"
184,"spotify:track:0qOnSQQF0yzuPWsXrQ9paz","Gym Class Heroes, Adam Levine","Stereo Hearts (feat. Adam Levine)","Decaydance/Fueled By Ramen",12,175,80,"603273"
185,"spotify:track:0a6zRnrjmaOcqsEIFkXIhw","Akhil","Khaab","Crown Records",101,165,126,"596012"
186,"spotify:track:5ZhKD46Q7mhsl0awl7ZMJc","Sachin-Jigar, Atif Aslam","Jeena Jeena","Eros Now Music",90,-1,59,"591999"
187,"spotify:track:41UQTit03jSLz0DoUZ3Eux","Shrylox","Aarmabh Hai Prachand X Polozehnie","Shrylox",187,-1,1,"590509"
188,"spotify:track:39LLxExYz6ewLAcYrzQQyP","Dua Lipa","Levitating","Warner Records",11,185,69,"589962"
189,"spotify:track:1skGwRjc7wYY70PJCAkKMr","Sidhu Moose Wala, AR Paisley, Mxrci","Love Sick","Sidhu Moose Wala",24,174,14,"587620"
190,"spotify:track:6Uj1ctrBOjOas8xZXGqKk4","Doja Cat","Woman","Kemosabe Records/RCA Records",6,195,52,"585642"
191,"spotify:track:6XmBh5HSdVzEAaqzEftL9t","Stephen Zechariah, T Suriavelan, Srinisha Jayaseelan","Adi Penne (Duet) - From Naam Series","Stephen Zechariah Musical",138,163,29,"583564"
192,"spotify:track:1SC5rEoYDGUK4NfG82494W","Lil Nas X","MONTERO (Call Me By Your Name)","Columbia",1,188,72,"582468"
193,"spotify:track:3HiobOOpSpMsi95WBKPBYk","Jeet Gannguli, Arijit Singh","Hamari Adhuri Kahani (Title Track)","Sony Music Entertainment India Pvt. Ltd.",168,183,40,"581837"
194,"spotify:track:3jtKSUiVDowKNBqVQbWaig","Amit Trivedi, Kavita Seth, Amitabh Bhattacharya","Iktara","Sony Music Entertainment India Pvt. Ltd.",73,-1,42,"581762"
195,"spotify:track:1feANd8EfcDP5UqSvbheM3","Sachet Tandon, Sachet-Parampara","Bekhayali (From ""Kabir Singh"")","T-Series",1,193,159,"580869"
196,"spotify:track:5eGsHi6RcL33gb9k89UYaB","Tegi Pannu, Manni Sandhu","Schedule","Collab Creations Ltd",40,191,40,"580478"
197,"spotify:track:2S6N9pbnkhQRyAx80HmF79","Mohammed Irfan","Banjaara (From ""Ek Villain"")","T-Series",167,167,3,"579945"
198,"spotify:track:7cVe3mYMIfhOlz1NXFWv70","Sidhu Moose Wala, Mxrci","0 to 100","Sidhu Moose Wala",45,-1,13,"579118"
199,"spotify:track:6UelLqGlWMcVH1E5c4H7lY","Harry Styles","Watermelon Sugar","Columbia",26,196,122,"577477"
